url,title,date,desc
https://arstechnica.com/gadgets/2025/03/google-has-a-fix-for-your-broken-chromecast-v2-unless-you-factory-reset/,Google has a fix for your broken Chromecast V2 unless you factory reset,2025-03-13,"Google's venerable 2015 Chromecast
attempted to self-destruct
earlier this week, upsetting a huge number of people who were still using the decade-old streaming dongles. Google was seemingly caught off guard by the devices glitching out all at the same time, but it promised to address the problem, and it has. Google says it has a fix ready to roll out, and most affected devices should be right as rain in the coming days.
Google is still not confirming the cause of the Chromecast outage, but it was almost certainly the result of a certificate expiring after 10 years. It would seem there was no one keeping an eye on the Chromecast's ticking time bomb, which isn't exactly surprising—Google has
moved on from the Chromecast brand
, focusing instead on the more capable Google TV streamer. Even if Google is done with the Chromecast, its customers aren't.
If you left your
2015 Chromecast
or Chromecast Audio alone to await a fix, you're in good shape. The update should be delivered automatically to the device soon. ""We’ve started rolling out a fix for the problem with Chromecast (2nd gen) and Chromecast Audio devices, which will be completed over the next few days. Users must ensure their device is connected to WiFi to receive the update,"" says Google."
https://arstechnica.com/gadgets/2025/03/googles-gemini-ai-can-now-see-your-search-history/,Google’s Gemini AI can now see your search history,2025-03-13,"Google is continuing its quest to get more people to use Gemini, and it's doing that by giving away even more AI computing. Today, Google is releasing a raft of improvements for the
Gemini 2.0 models
, and as part of that upgrade, some of the AI's most advanced features are now available to free users. You'll be able to use the improved Deep Research to get in-depth information on a topic, and Google's newest reasoning model can peruse your search history to improve its understanding of you as a person. What could go wrong?
Like most big AI players, Google has a number of different models available. Gemini 2.0 Flash Thinking Experimental is the company's most capable
multistep reasoning model
, which can consider complex topics and gives you a window into its ""thought"" process. Google is adding a lot to this model in its latest round of updates, enabling a much larger 1-million-token context window, file uploads, and faster output. It also supports more Google apps with connections to Calendar, Notes, Tasks, and Photos.
With the aim of making Gemini more personal to you, Google is also plugging Flash Thinking Experimental into a new source of data: your search history.
Google stresses
that you have to opt in to this feature, and it can be disabled at any time. Gemini will even display a banner to remind you it's connected to your search history so you don't forget. If you grant access, the AI can allegedly understand you better and offer more relevant recommendations. It feels a bit strange to turn Gemini loose on such personal data, but Google already knows what you look up on the Internet. You're not giving up much more if you let the robot have a peek. This is apparently just the start of Google's efforts to personalize the AI."
https://arstechnica.com/gadgets/2025/03/at-gdc-google-promises-more-pc-games-on-android-more-android-games-on-pc/,Google is bringing every Android game to Windows in big gaming update,2025-03-13,"The annual Game Developers Conference is about to kick off, and even though Stadia is
dead and buried
, Google has a lot of plans for games. It's expanding tools that help PC developers bring premium games to Android, and games are heading in the other direction, too. The PC-based Play Games platform is expanding to bring every single Android game to Windows. Google doesn't have a firm timeline for all these changes, but 2025 will be an interesting year for the company's gaming efforts.
Google
released the first beta
of Google Play Games on PC back in 2022, allowing you to play Android games on a PC. It has chugged along quietly ever since, mostly because of the anemic and largely uninteresting game catalog. While there are hundreds of thousands of Android games, only a handful were made available in the PC client. That's changing in a big way now that Google is bringing over every Android game from Google Play.
Starting today, you'll see thousands of new games in Google Play Games on PC. Developers actually have to
opt out
if they don't want their games available on Windows machines via Google Play Games. Google says this is possible thanks to improved custom controls, making it easy to map keyboard and gamepad controls onto games that were designed for touchscreens (see below). The usability of these mapped controls will probably vary dramatically from game to game.
While almost every Android game will soon be available on Windows, not all will get top billing. Google Play Games on PC has a playability badge, indicating a game has been tested on Windows. Games that have been specifically optimized for PC get a more prominent badge. Games with the ""Playable"" or ""Optimized"" distinction will appear throughout the client in lists of suggested titles, but untested games will only appear if you search for them. However, you can install them all just the same, and they'll work better on AMD-based machines, support for which has been lacking throughout the beta."
https://arstechnica.com/ai/2025/03/ai-coding-assistant-refuses-to-write-code-tells-user-to-learn-programming-instead/,"AI coding assistant refuses to write code, tells user to learn programming instead",2025-03-13,"On Saturday, a developer using Cursor AI for a racing game project hit an unexpected roadblock when the programming assistant abruptly refused to continue generating code, instead offering some unsolicited career advice.
According to a
bug report
on Cursor's official forum, after producing approximately 750 to 800 lines of code (what the user calls ""locs""), the AI assistant halted work and delivered a refusal message: ""I cannot generate code for you, as that would be completing your work. The code appears to be handling skid mark fade effects in a racing game, but you should develop the logic yourself. This ensures you understand the system and can maintain it properly.""
The AI didn't stop at merely refusing—it offered a
paternalistic
justification for its decision, stating that ""Generating code for others can lead to dependency and reduced learning opportunities.""
A screenshot of the Cursor forum post describing the refusal.
Credit:
Benj Edwards
Cursor, which launched in 2024, is an
AI-powered code editor
built on external large language models (LLMs) similar to those powering generative AI chatbots, like OpenAI's GPT-4o and Claude 3.7 Sonnet. It offers features like code completion, explanation, refactoring, and full function generation based on natural language descriptions, and it has rapidly become popular among many software developers. The company offers a Pro version that ostensibly provides enhanced capabilities and larger code-generation limits.
The developer who encountered this refusal, posting under the username ""janswist,"" expressed frustration at hitting this limitation after ""just 1h of vibe coding"" with the Pro Trial version. ""Not sure if LLMs know what they are for (lol), but doesn't matter as much as a fact that I can't go through 800 locs,"" the developer wrote. ""Anyone had similar issue? It's really limiting at this point and I got here after just 1h of vibe coding.""
One forum member
replied
, ""never saw something like that, i have 3 files with 1500+ loc in my codebase (still waiting for a refactoring) and never experienced such thing.""
Cursor AI's abrupt refusal represents an ironic twist in the rise of ""
vibe coding
""—a term coined by Andrej Karpathy that describes when developers use AI tools to generate code based on natural language descriptions without fully understanding how it works. While vibe coding prioritizes speed and experimentation by having users simply describe what they want and accept AI suggestions, Cursor's philosophical pushback seems to directly challenge the effortless ""vibes-based"" workflow its users have come to expect from modern AI coding assistants."
https://arstechnica.com/gadgets/2025/03/epic-games-is-addressing-one-of-windows-on-arms-last-big-app-compatibility-gaps/,Epic Games is addressing one of Windows-on-Arm’s last big app compatibility gaps,2025-03-13,"Using a Windows PC with an Arm-based Snapdragon processor in it feels a lot like using a regular-old Intel or AMD PC these days, thanks to the work developers have put in to get their apps running natively on Arm chips and the work Microsoft has done on
Windows' Prism technology for translating x86 apps to run on Arm processors
. But some of the old compatibility gaps remain.
For example, while many PC games will run well enough on an Arm PC without any changes from the game's developer, online multiplayer games that rely on kernel-level anti-cheat software generally don't work. Drivers and other lower-level Windows software can't be translated by Prism, and in many cases, the Arm PC user base is still small enough that developers haven't put in the work to get Arm versions of their software up and running.
Epic Games is taking a step in that direction later this year—today, the company
announced
that it's bringing its
Epic Online Services Easy Anti-Cheat
software to Arm PCs, along with official Windows-on-Arm support for
Fortnite
. Both are coming to Arm PCs ""later this year.""
""In addition to releasing Windows on Snapdragon anti-cheat support for
Fortnite
,
we will bring this support to developers through an Epic Online Services SDK release,"" the company's blog post says. ""This will enable developers using Easy Anti-Cheat to bring this compatibility to their own games."""
https://arstechnica.com/ai/2025/03/anthropics-ceo-wonders-if-future-ai-should-have-option-to-quit-unpleasant-tasks/,"Anthropic CEO floats idea of giving AI a “quit job” button, sparking skepticism",2025-03-13,"Anthropic CEO Dario Amodei
raised a few eyebrows
on Monday after suggesting that advanced AI models might someday be provided with the ability to push a ""button"" to quit tasks they might find unpleasant. Amodei made the provocative remarks
during an interview
at the Council on Foreign Relations, acknowledging that the idea ""sounds crazy.""
""So this is—this is another one of those topics that’s going to make me sound completely insane,"" Amodei said during the interview. ""I think we should at least consider the question of, if we are building these systems and they do all kinds of things like humans as well as humans, and seem to have a lot of the same cognitive capacities, if it quacks like a duck and it walks like a duck, maybe it’s a duck.""
Amodei's comments came in response to an audience question from data scientist Carmem Domingues about Anthropic's
late-2024 hiring
of AI welfare researcher Kyle Fish ""to look at, you know, sentience or lack of thereof of future AI models, and whether they might deserve moral consideration and protections in the future."" Fish currently investigates the highly contentious topic of whether AI models could possess sentience or otherwise merit moral consideration.
""So, something we're thinking about starting to deploy is, you know, when we deploy our models in their deployment environments, just giving the model a button that says, 'I quit this job,' that the model can press, right?"" Amodei said. ""It's just some kind of very basic, you know, preference framework, where you say if, hypothesizing the model did have experience and that it hated the job enough, giving it the ability to press the button, 'I quit this job.' If you find the models pressing this button a lot for things that are really unpleasant, you know, maybe you should—it doesn't mean you're convinced—but maybe you should pay some attention to it."""
https://arstechnica.com/gadgets/2025/03/sonos-reportedly-cancels-its-plans-for-an-apple-tv-streaming-box-rival/,Sonos’ streaming box is reportedly canceled. Good riddance.,2025-03-12,"Sonos has canceled plans to release a streaming box,
The Verge
reported today. The audio company never publicly confirmed that it was making a streaming set-top box, but rumors of its impending release have been floating around
since November 2023
. With everything that both Sonos and streaming users have going on right now, though, a Sonos-branded rival to the Apple TV 4K wasn’t a good idea anyway.
Bloomberg’s Mark Gurman was the first to report on Sonos’ purported streaming ambitions. He reported that Sonos’ device would be a
black box that cost $150 to $200
.
At first glance, it seemed like a reasonable idea. Sonos was facing increased competition for wireless speakers from big names like Apple and Bose. Meanwhile, Sonos speaker sales growth had slowed down, making portfolio diversification seem like a prudent way to protect business.
By 2025, however, the reported plans for Sonos’ streaming box sounded less reasonable and appealing, while the market for streaming devices had become significantly more competitive.
A saturated market
In February,
The Verge
, citing anonymous sources, reported that Sonos was now planning a streaming player that would “cost between $200 and $400.” That’s a lot to charge in a market where most people have already found their preferred platform. Those who want something cheap and don’t mind ads settle for something like Roku. People who hate ads opt for an Apple TV box. There are people who swear by their Fire Sticks and plenty who are happy with whatever operating system (OS) their smart TV arrives with. Sonos would have struggled to convince people who have successfully used some of those streaming devices
for years
that they suddenly need a new one that's costlier than alternatives, including some smart TVs. In the US especially, the
TV OS market
is considered heavily saturated, presenting an uphill battle for newcomers."
https://arstechnica.com/gadgets/2025/03/new-intel-ceo-lip-bu-tan-will-pick-up-where-pat-gelsinger-left-off/,New Intel CEO Lip-Bu Tan will pick up where Pat Gelsinger left off,2025-03-12,"After a little over three months, Intel has a new CEO to replace
ousted former CEO Pat Gelsinger
. Intel's board
announced
that Lip-Bu Tan will begin as Intel CEO on March 18, taking over from interim co-CEOs David Zinsner and Michelle Johnston Holthaus.
Gelsinger was booted from the CEO position by Intel's board on December 2 after several quarters of losses, rounds of layoffs, and
canceled
or
spun-off
side projects. Gelsinger sought to turn Intel into a foundry company that also manufactured chips for fabless third-party chip design companies, putting it into competition with Taiwan Semiconductor Manufacturing Company(TSMC), Samsung, and others, a plan that Intel said it was still committed to when it let Gelsinger go.
Intel said that Zinsner would stay on as executive vice president and CFO, and Johnston Holthaus would remain CEO of the Intel Products Group, which is mainly responsible for Intel's consumer products. These were the positions both executives held before serving as interim co-CEOs.
Tan was previously a member of Intel's board from 2022 to 2024 and has been a board member for several other technology and chip manufacturing companies, including Hewlett Packard Enterprise, Semiconductor Manufacturing International Corporation (SMIC), and Cadence Design Systems."
https://arstechnica.com/gadgets/2025/03/cockpit-voice-recorder-survived-fiery-philly-crash-but-stopped-taping-years-ago/,Cockpit voice recorder survived fiery Philly crash—but stopped taping years ago,2025-03-12,"Cottman Avenue in northern Philadelphia is a busy but slightly down-on-its-luck urban thoroughfare that has had a strange couple of years.
You might remember the truly bizarre 2020 press conference held—for no discernible reason—at Four Seasons Total Landscaping, a half block off Cottman Avenue, where a not-yet-
disbarred
Rudy Giuliani led a farcical ensemble of characters in an event so weird it has been immortalized in its
own, quite lengthy, Wikipedia article
.
Then in 2023, a truck carrying gasoline caught fire just a block away, right where Cottman passes under I-95. The
resulting fire damaged I-95 in both directions
, bringing down several lanes and closing I-95 completely for some time. (This also generated a Wikipedia article.)
This year, on January 31, a little further west on Cottman, a Learjet 55 medevac flight crashed one minute after takeoff from Northeast Philadelphia Airport. The plane, fully loaded with fuel for a trip to Springfield, Missouri, came down near a local mall, clipped a commercial sign, and exploded in a fireball when it hit the ground. The crash generated a debris field 1,410 feet long and 840 feet wide, according to the National Transportation and Safety Board (NTSB), and it killed six people on the plane and one person on the ground.
The crash was important enough to attract the attention of Pennsylvania Governor Josh Shapiro and Mexican President Claudia Sheinbaum. (The airplane crew and passengers were all Mexican citizens; they were transporting a young patient who had just wrapped up treatment at a Philadelphia hospital.) And yes, it, too,
generated a Wikipedia article
.
NTSB has been investigating ever since, hoping to determine the cause of the accident. Tracking data showed that the flight reached an altitude of 1,650 feet before plunging to earth, but the plane's pilots never conveyed any distress to the local air traffic control tower.
Investigators searched for the plane's cockpit voice recorder, which might provide clues as to what was happening in the cockpit during the crash. The Learjet did have such a recorder, though it was an older, tape-based model. (Newer ones are solid-state, with fewer moving parts.) Still, even this older tech should have recorded the last 30 minutes of audio, and these units are rated to withstand impacts of 3,400 Gs and to survive fires of 1,100° Celsius (2,012° F) for a half hour. Which was important, given that the plane had both burst into flames and crashed directly into the ground."
https://arstechnica.com/gadgets/2025/03/googles-new-gemma-3-ai-model-is-optimized-to-run-on-a-single-gpu/,"Google’s Gemma 3 is an open source, single-GPU AI with a 128K context window",2025-03-12,"Most new AI models go big—more parameters, more tokens, more everything. Google's newest AI model has some big numbers, but it's also tuned for efficiency.
Google says
the Gemma 3 open source model is the best in the world for running on a single GPU or AI accelerator. The latest Gemma model is aimed primarily at developers who need to create AI to run in various environments, be it a data center or a smartphone. And you can tinker with Gemma 3 right now.
Google claims Gemma 3 will be able to tackle more challenging tasks compared to the older open Google models. The context window, a measure of how much data you can input, has been expanded to 128,000 from 8,192 tokens in
previous Gemma models
. Gemma 3, which is based on the proprietary Gemini 2.0 foundation, is also a multimodal model capable of processing text, high-resolution images, and even video. Google also has a new solution for image safety called ShieldGemma 2, which can be integrated with Gemma to help block unwanted images in three content categories: dangerous, sexual, or violent.
Most of the popular AI models you've heard of run on collections of servers in a data center, filled to the brim with AI computing power. Many of them are far too large to run on the kind of hardware you have at home or in the office. The release of the first Gemma models last year gave developers and enthusiasts another low-hardware option to compete with the likes of Meta Llama3. There has been a drive for efficiency in AI lately, with models like
DeepSeek R1
gaining traction on the basis of lower computing costs."
https://arstechnica.com/gadgets/2025/03/irobot-says-there-is-substantial-doubt-about-it-as-a-going-concern/,iRobot says there is “substantial doubt” about it as a “going concern”,2025-03-12,"Robotics firm iRobot, originator of the robotic vacuum Roomba facing stiff competition from lower-priced competitors,
told investors Tuesday
that there was ""substantial doubt"" about the company's survival ""as a going concern"" in the next year or so.
Investors took iRobot at its word, and its stock price had fallen nearly 40 percent as of 10:20 am Wednesday from the day before. The dire accounting language and market reaction are nothing new for tech firms, but iRobot's annual report suggests deeper issues than investor confidence. The company saw revenue drop 47 percent in the fourth quarter, it is actively seeking to renegotiate its largest loans, and it has launched a ""formal strategic review"" to consider refinancing, sale, or other alternatives.
The shaky world of consumer robotics
iRobot's fortunes have changed dramatically since 2022, when Amazon announced a
$1.7 billion bid
to buy the struggling but prominent firm.
Amazon had long been active in warehouse and logistics robotics but had shown interest in home automation with its
quirky Astro bot
, which has taken a long time to
roll out to very few people
but is still technically available as an
invite-only preview at $1,600
. The version aimed at businesses was
bricked, and refunds were given
last summer.
Regulators in Europe could not be convinced that the owner of the world's largest online storefront would not use its leverage to harm rival robot vacuum makers' chances. Lobbying group Computer & Communications Industry Association
protested at the time
, suggesting there was ""no plausible risk to competition from a US retailer acquiring a struggling US vacuum maker in a sector overtaken by dynamic Chinese manufacturers."""
https://arstechnica.com/gadgets/2025/03/pocket-casts-makes-its-web-player-free-takes-shots-at-spotify-and-ai/,"Pocket Casts makes its web player free, takes shots at Spotify and AI",2025-03-11,"""The future of podcasting shouldn't be locked behind walled gardens,""
writes the team at Pocket Casts
. To push that point forward, Pocket Casts, owned by the company behind WordPress, Automattic Inc., has made its
web player free to everyone
.
Previously available only to logged-in Pocket Casts users paying $4 per month, Pocket Casts now offers nearly any public-facing podcast feed for streaming, along with controls like playback speed and playlist queueing. If you create an account, you can also sync your playback progress, manage your queue, bookmark episode moments, and save your subscription list and listening preferences. The free access also applies to its clients for
Windows
and
Mac
.
""Podcasting is one of the last open corners of the Internet, and we’re here to keep it that way,"" Pocket Casts' blog post reads. For those not fully tuned into the podcasting market, this and other statements in the post—like sharing ""without needing a specific platform's approval"" and ""podcasts belong to the people, not corporations""—are largely shots at Spotify, and to a much lesser extent other streaming services, which have sought to wrap podcasting's originally open and RSS-based nature inside proprietary markets and formats.
Pocket Casts also took a bullet point to note that ""discovery should be organic, not algorithm-driven,"" and that users, not an AI, should ""promote what’s best for the platform.""
Spotify
spent big to acquire podcasts
like the Joe Rogan Experience, along with
podcast analytic and advertising tools
. As the platform now starts
leaning into video podcasts
, seeking to compete with the podcasts simulcasting or exclusively on YouTube, Pocket Casts' concerns about the open origins of podcasting being co-opted are not unfounded. (Pocket Casts' current owner, Automattic, is involved in
an extended debate in public, and the courts
, regarding how ""open"" some of its products should be.)"
https://arstechnica.com/ai/2025/03/openai-pushes-ai-agent-capabilities-with-new-developer-api/,OpenAI pushes AI agent capabilities with new developer API,2025-03-11,"The AI industry is doing its best to will ""agents""—pieces of AI-driven software that can perform multistep actions on your behalf—into reality. Several tech companies,
including Google
, have emphasized agentic features recently, and in January, OpenAI CEO Sam Altman
wrote
that 2025 would be the year AI agents ""join the workforce.""
OpenAI is working to make that promise happen. On Tuesday, OpenAI
unveiled
a new ""
Responses API
"" designed to help software developers create AI agents that can perform tasks independently using the company's AI models. The Responses API will eventually replace the current
Assistants API
, which OpenAI plans to retire in the first half of 2026.
With the new offering, users can develop custom AI agents that
scan company files
with a file search utility that rapidly checks company databases (with OpenAI promising not to train its models on these files) and
navigates websites
—similar to functions available through
OpenAI's Operator
agent, whose underlying Computer-Using Agent (CUA) model developers can also access to enable automation of tasks like data entry and other operations.
However, OpenAI acknowledges that its CUA model is not yet reliable for automating tasks on operating systems and can make unintended mistakes. The company describes the new API as an early iteration that it will continue to improve over time."
