url,title,date,desc
https://arstechnica.com/gadgets/2025/02/google-chrome-may-soon-use-ai-to-detect-leaked-passwords-and-replace-them/,Google Chrome may soon use “AI” to replace compromised passwords,2025-02-11,"Google's Chrome browser might soon get a useful security upgrade: detecting passwords used in data breaches and then generating and storing a better replacement. Google's preliminary copy suggests it's an ""AI innovation,"" though exactly how is unclear.
Noted software digger Leopeva64 on X found
a new offering in the AI settings
of a very early build of Chrome. The option, ""Automated password Change"" (so, early stages—as to not yet get a copyedit), is described as, ""When Chrome finds one of your passwords in a data breach, it can offer to change your password for you when you sign in.""
Chrome already has a feature that warns users if the passwords they enter have been identified in a breach and will prompt them to change it. As
noted by Windows Report
, the change is that now Google will offer to change it for you on the spot rather than simply prompting you to handle that elsewhere. The password is automatically saved in
Google's Password Manager
and ""is encrypted and never seen by anyone,"" the settings page claims.
If you want to see how this works, you need to
download a Canary version of Chrome
. In the flags settings (navigate to ""chrome://flags"" in the address bar), you'll need to enable two features: ""Improved password change service"" and ""Mark all credential as leaked,"" the latter to force the change notification because, presumably, it's not hooked up to actual leaked password databases yet. Go to almost any non-Google site, enter in any user/password combination to try to log in, and after it fails or you navigate elsewhere, a prompt will ask you to consider changing your password."
https://arstechnica.com/gadgets/2025/02/ios-18-3-1-update-fixes-security-flaw-used-in-extremely-sophisticated-attack/,iOS 18.3.1 update fixes security flaw used in “extremely sophisticated attack”,2025-02-11,"Apple has released new security fixes for iPhones and iPads in the form of
iOS 18.3.1 and iPadOS 18.3.1
. According to Apple's release notes, these updates patch an actively exploited security flaw in the USB Restricted Mode feature, which requires users to unlock their devices periodically to continue using USB data connections via a device's Lightning or USB-C port.
Apple says that the vulnerability, labeled CVE-2025-24200, ""may have been exploited in an extremely sophisticated attack against specific targeted individuals."" We don't know anything more specific about who those individuals are or why they might have been targeted.
Apple has also supplied an identical fix for older iPads in the form of
iPadOS 17.7.5
, which is still being updated on old models like the 2nd-generation 12.9-inch iPad Pro, the 10.5-inch iPad Pro, and the 6th-generation iPad.
Apple has released updates for some of its other operating systems, too: macOS Sequoia 15.3.1, macOS Sonoma 14.7.4, macOS Ventura 13.7.4, watchOS 11.3.1, and visionOS 2.3.1. The company's
security updates page
says these releases don't fix any currently published CVEs, but there's always a chance this could change later on as more CVEs are disclosed."
https://arstechnica.com/tech-policy/2025/02/t-mobile-expands-starlink-texting-service-to-cover-verizon-and-att-users/,What you need to know about the T-Mobile Starlink mobile service,2025-02-10,"T-Mobile yesterday
announced
more details of its new service powered by Starlink and said Verizon and AT&T customers can use the satellite offering, too. The standard price will be $15 a month as an add-on for T-Mobile customers, and $20 a month for people who don't have T-Mobile as their primary carrier.
While we've written numerous articles about the Starlink/T-Mobile collaboration over the past two and a half years, the service's beta test and a
Super Bowl commercial
are raising awareness that it exists. In this article we'll answer some questions you might have about T-Mobile Starlink (yes, T-Mobile Starlink is the official name of the service).
What is this thing anyway?
Over the
past 13 months
, SpaceX's Starlink division has launched about 450 Direct to Cell satellites that can provide service to mobile phones in areas where there are no cell towers. Starlink is partnering with cellular carriers in multiple countries, and T-Mobile is its primary commercial partner in the US.
T-Mobile says the goal is to provide telecom service in dead zones, the 500,000 square miles of the US that aren't reached by any terrestrial cell tower. When a user crosses into a dead zone, their phone is supposed to automatically connect to Starlink satellites. T-Mobile Starlink only supports texting for now, but T-Mobile says voice calls and data service will be available eventually.
Who can use it
T-Mobile Starlink is obviously available to T-Mobile customers, but the carrier said that Verizon and AT&T customers can also use it on their existing phones without switching entirely to T-Mobile. Verizon and AT&T customers will need an unlocked phone with
eSIM technology
, which lets users activate a cellular plan without a physical SIM card."
https://arstechnica.com/gadgets/2025/02/new-wikitok-web-app-allows-infinite-tiktok-style-scroll-of-wikipedia/,Developer creates endless Wikipedia feed to fight algorithm addiction,2025-02-07,"On Wednesday, a New York-based app developer named Isaac Gemal debuted a new site called
WikiTok,
where users can vertically swipe through an endless stream of Wikipedia article stubs in a manner similar to the interface for video-sharing app TikTok.
It's a neat way to stumble upon interesting information randomly, learn new things, and spend spare moments of boredom without reaching for an algorithmically addictive social media app. Although to be fair, WikiTok is addictive in its own way, but without an invasive algorithm tracking you and pushing you toward the lowest-common-denominator content. It's also thrilling because you never know what's going to pop up next.
WikiTok, which works through mobile and desktop browsers, feeds visitors a random list of Wikipedia articles—culled from the Wikipedia API—into a vertically scrolling interface. Despite the name that hearkens to TikTok, there are currently no videos involved. Each entry is accompanied by an image pulled from the corresponding article. If you see something you like, you can tap ""Read More,"" and the full Wikipedia page on the topic will open in your browser.
A screenshot of WikiTok, a web app running in Safari on an iPhone.
Credit:

          
          Benj Edwards
For now, the feed is truly random, and Gemal is currently resisting calls to automatically tailor the stream of articles to the user's interests based on what they express interest in.
""I have had plenty of people message me and even make issues on my GitHub asking for some insane crazy WikiTok algorithm,"" Gemal told Ars. ""And I had to put my foot down and say something along the lines that we're already ruled by ruthless, opaque algorithms in our everyday life; why can't we just have one little corner in the world without them?""
The breadth of topics you'll encounter on WikiTok is staggering, owing to the wide range of knowledge that Wikipedia covers."
https://arstechnica.com/gadgets/2025/02/lets-encrypt-is-ending-expiration-notice-emails-for-some-very-good-reasons/,Let’s Encrypt is ending expiration notice emails—for some very good reasons,2025-02-05,"Let's Encrypt
has been providing free ""wildcard"" certificates for websites for nearly seven years, enabling HTTPS connections for millions of domains and doing the whole Internet a real solid.
Now the nonprofit is ending a useful service, but in an exceedingly rare happenstance, it's probably a good thing for everyone. Starting June 4, 2025, Let's Encrypt will
no longer notify its subscribers that their certification is about to expire
and needs renewal. Some hosting providers automatically obtain and manage certificates from Let's Encrypt, so there's not much for them to do. Everyone else will have to do something, and likely it will still be free and automated.
Let's Encrypt is ending automated emails for four stated reasons, and all of them are pretty sensible. For one thing, lots of customers have been able to automate their certificate renewal. For another, providing the expiration notices costs ""tens of thousands of dollars per year"" and adds complexity to the nonprofit's infrastructure as they are looking to add new and more useful services.
If those were not enough, there is this particularly notable reason:
Providing expiration notification emails means that we have to retain millions of email addresses connected to issuance records. As an organization that values privacy, removing this requirement is important to us.
Let's Encrypt recommends using
Red Sift Certificates Lite
to monitor certificate expirations, a service that is free for up to 250 certificates. The service also points to
other options
, including Datadog SSL monitoring and TrackSSL."
https://arstechnica.com/gadgets/2025/02/many-americans-still-dont-understand-how-easily-iot-devices-can-get-bricked/,Many Americans still don’t understand how easily IoT devices can get bricked,2025-02-05,"I don’t know who needs to hear this, but your connected gadgets need software updates to retain not just their security but also, frequently, key features. If you read Ars Technica regularly, you probably don’t need to hear that. You already know that smart device manufacturers have a reputation for
ending support
for
often-expensive devices
, making them insecure and/or not work as intended. But, per a survey from Consumer Reports of 2,130 consumers, many Americans are buying into the Internet of Things (IoT) without understanding the risks involved in losing vendor support: wasted money when devices are bricked and cyber and physical security threats.
Consumer Reports’
American Experiences Survey
, taken from December 6–16, claims the margin of error for its survey is +/- 2.59 percentage points, with 95 percent confidence. The publication said that 36 percent of respondents were four-year college graduates, 63 percent have a household income of at least $50,000, and the median age of respondents was 47 (you can find more information about Consumer Reports’ methodology
here
).
Consumer Reports'
subsequent report
, released today, revealed a worrying potential education gap around IoT devices and the importance of ongoing software support:
Among people with any type of connected device... 43 percent... said that the last time they purchased one they were not aware that it might lose software support at some point. Roughly a third of consumers with a connected device (35 percent) said that they had been aware that their product would lose software support at some point, and 22 percent said they did not recall.
The most common response, at 40 percent, to the question, “If any of your smart devices has lost software support, how did you first find out?” was “it stopped working.” Fifteen percent said that they learned about the loss of support through the media. Thirty-nine percent pointed to manufacturer correspondence. Of course, it’s possible that some of those 40 percent of respondents simply missed vendor communication or even forgot about it."
https://arstechnica.com/gadgets/2025/02/popular-linux-orgs-freedesktop-and-alpine-linux-are-scrambling-for-new-web-hosting/,Popular Linux orgs Freedesktop and Alpine Linux are scrambling for new web hosting,2025-02-03,"In what is becoming a sadly regular occurrence, two popular free software projects, X.org/Freedesktop.org and Alpine Linux, need to rally some of their millions of users so that they can continue operating.
Both services have largely depended on free server resources provided by
Equinix
(formerly Packet.net) and its Metal division for the past few years. Equinix announced recently that it was
sunsetting its bare-metal sales and services
, or renting out physically distinct single computers rather than virtualized and shared hardware. As
reported by the Phronix blog
, both free software organizations have until the end of April to find and fund new hosting, with some fairly demanding bandwidth and development needs.
An
issue ticket
on Freedesktop.org's GitLab repository provides the story and the nitty-gritty needs of that project. Both the X.org foundation (home of
the 40-year-old window system
) and Freedesktop.org (a shared base of specifications and technology for free software desktops, including Wayland and
many more
) used Equinix's donated space.
Equinix Metal ""were very kind and generous with us and even if it's a shame we have to move out on a short notice, all things come to an end,"" writes Benjamin Tissoires, admin for the project, on the issue page. Tissoires lays out the project's needs—more than 400GB of database storage and close to 100TB of storage data—and a wishlist for new hosting.
An Equinix spokesperson wrote to Ars that the firm is ending its credit program as part of its wind-down of bare metal serving, ""as we focus on the growth and acceleration of parts of our business, like colocation, interconnection, and hyperscale."" Customers with free credits could keep using Equinix through June 2026, but at market-on-demand rates, the spokesperson wrote."
https://arstechnica.com/gadgets/2025/02/microsoft-365s-vpn-feature-will-be-shut-off-at-the-end-of-the-month/,Microsoft 365’s VPN feature will be shut off at the end of the month,2025-02-03,"Last month, Microsoft
announced
that it was increasing the prices for consumer Microsoft 365 plans for the first time since introducing them as Office 365 plans more than a decade ago. Microsoft is using new Copilot-branded generative AI features to justify the price increases, which amount to an extra $3 per month or $30 per year for both individual and family plans.
But Microsoft giveth (and chargeth more) and Microsoft taketh away; according to
a support page
, the company is also removing the ""privacy protection"" VPN feature from Microsoft 365's
Microsoft Defender
app for Windows, macOS, iOS, and Android. Other Defender features, including identity theft protection and anti-malware protection, will continue to be available. Privacy protection will stop functioning on February 28.
Microsoft didn't say exactly why it was removing the feature, but the company implied that not enough people were using the service.
""We routinely evaluate the usage and effectiveness of our features. As such, we are removing the privacy protection feature and will invest in new areas that will better align to customer needs,"" the support note reads.
Cutting features at the same time that you raise prices for the first time ever is not, as they say, a Great Look. But the Defender VPN feature was already a bit limited compared to other dedicated VPN services. It came with a 50GB per user, per month data cap, and it automatically excluded ""content heavy traffic from reputable sites"" like YouTube, Netflix, Disney+, Amazon Prime, Facebook, Instagram, and Whatsapp."
https://arstechnica.com/gadgets/2025/01/google-pixel-4as-ruinous-battery-performance-update-is-a-bewildering-mess/,Google Pixel 4a’s ruinous “Battery Performance” update is a bewildering mess,2025-01-31,"What exactly is wrong with the batteries in some of Google's Pixel 4a phones still out there? Google has not really said. Now that many Pixel 4a owners are experiencing drastically reduced battery life after
an uncommon update for an end-of-life phone
, they are facing a strange array of options with no path back to the phone they had.
Google's ""
Pixel 4a Battery Performance Program
,"" announced in early January, told owners that an automatic update would, for some ""Impacted Devices,"" reduce their battery's runtime and charging performance. ""Impacted"" customers could choose, within one year's time, between three ""appeasement"" options: sending in the phone for a battery replacement, getting $50 or the equivalent in their location, or receiving $100 in credit in the Google Store toward a new Pixel phone. No safety or hazard issue was mentioned in the support document.
Ars has reached out to Google about the Pixel 4a battery updates and appeasement options provided and will update this post with any response.
The curious kernel
Google did not explain why only certain devices were affected, but Hector Martin—of
Asahi Linux
,
open source Kinect drivers
, and other fame—took apart the update's binary kernel and
has some guesses
.
Martin points out that the updated Pixel 4a kernel has these interesting characteristics:
It seems to have been built by a Google engineer ""on their personal machine, not the proper buildsystem.""
There is no source provided, as would normally be required of a Linux kernel build, though it may only need to be provided on request under the GNU General Public License.
The maximum charge voltage of certain battery profiles changes from 4.44 volts to 3.95, which would mean batteries cannot charge to anywhere near their former potential.
There are two main battery profiles, with distinct ""ATL"" and ""LSN"" markers; Martin suggests they relate to
Amperex Technology Limited
and
Lishen
, manufacturers of battery cells.
LSN-tagged batteries assigned the ""debug"" profile can see capacity reduced from 3,080 milliamp hours (mAh) to 1,539 mAh."
https://arstechnica.com/gadgets/2025/01/q1-earnings-apple-sees-a-sales-slip-in-china-worrying-investors/,"In Apple’s first-quarter earnings, the Mac leads the way in sales growth",2025-01-30,"Apple fell slightly short of investor expectations when it reported its
first-quarter earnings
today. While sales were up 4 percent overall, the iPhone showed signs of weakness, and sales in the Chinese market slipped by just over 11 percent.
CEO Tim Cook told
CNBC
that the iPhone performed better in countries where Apple Intelligence was available, like the US—seemingly suggesting that the slip was partially because Chinese consumers do not see enough reason to buy new phones without Apple Intelligence. (He also said, ""Half of the decline is due to a change in channel inventory."") iPhone sales also slipped in China during this same quarter last year; this was the first full quarter during which the iPhone 16 was available.
In any case, Cook said the company plans to roll out Apple Intelligence in additional languages, including Mandarin, this spring.
Apple's wearables category also declined slightly, but only by 2 percent.
Despite the trends that worried investors, Apple reported $36.33 billion in net revenue for the first quarter. That's 7.1 percent more than last year's Q1. This was driven by the Mac, the iPad, and Services (which includes everything from Apple Music to iCloud)—all of which saw slight upticks in sales. Services was up 14 percent, continuing a strong streak for that business, while the Mac and the iPad both jumped up 15 percent.
The uptick in Mac and iPad sales was likely helped by several new Mac models and a new iPad mini starting shipments last October.
Cook shared some other interesting numbers in the earnings call with investors and the press: The company has an active base of 2.35 billion devices, and it has more than 1 billion active subscriptions."
https://arstechnica.com/gadgets/2025/01/microsoft-updates-intel-based-surface-pcs-but-regular-people-still-cant-buy-them/,"Microsoft updates Intel-based Surface PCs, if you can pay for them",2025-01-30,"Microsoft
switched the Surface Pro tablet and both sizes of Surface Laptop
from Intel and AMD's processors to Qualcomm's Arm-based processors last summer, part of a renewed hardware and software push to make the Arm version of Windows a thing. That ended a few years of a bifurcated approach, where the Intel and AMD versions of Surface PCs were the ""main"" versions and the Arm variants felt more like proof-of-concept side projects.
But if you work in a large organization or you're an IT administrator, the bifurcated approach continues. Microsoft announced
some business-only versions
of the Surface Pro tablet and the Surface Laptop last year that continued to use Intel processors, and
today it's announcing two more
, this time using Intel's
Lunar Lake-based Core Ultra CPUs
.
The refresh includes a new Surface Pro tablet and both 13- and 15-inch versions of the Surface Laptop, updated with most of the same design tweaks that the Qualcomm versions of the devices got last year (for example, a slightly larger 13.8-inch screen on the smaller version of the Surface Laptop, up from 13.5 inches). Generally, they have similar dimensions, weights, and configuration options as their Arm counterparts, including an OLED display option for the Surface Pro.
Officially, Microsoft refers to the devices as the Surface Pro 11th Edition for Business and the Surface Laptop 7th Edition for Business, the same generation numbers it uses for the Arm-based Qualcomm Snapdragon versions it sells to consumers.
Why the business-specific branding? Microsoft's x86-to-Arm app translation layer,
now called Prism
, is capable of running many legacy apps, and it has become much more common for developers to release both x86 and Arm-native versions of their Windows apps. But Windows and x86 processors were closely intertwined for decades, and lingering compatibility issues remain. Companies and other large organizations are more likely to have made large investments in obscure software or hardware that uses specialized drivers, things that can't be translated automatically by Prism and whose developers are less incentivized to prioritize niche features like Arm compatibility.
The Lunar Lake processors include a neural processing unit (NPU) fast enough to qualify for Microsoft's Copilot+ PC label, which unlocks a few AI and machine learning-related features that aren't available on most Windows 11 PCs. At this point, many of those features are still in preview, including the overhauled Windows Recall, a feature called
Click To Do
that ""identif[ies] text and images on your screen that you can take actions with,"" and an updated Windows Search that tries to do a better job understanding
plain-language queries
. For now, at least, it's worth noting that the Snapdragon Copilot+ PCs are all getting these features first, and so far, Intel and AMD PCs have gotten them weeks later."
https://arstechnica.com/gadgets/2025/01/streaming-prices-climb-in-2025-after-already-surpassing-inflation-rates/,Streaming prices climb in 2025 after already surpassing inflation rates,2025-01-29,"If you were hoping for a respite from rising streaming subscription fees in 2025, you’re out of luck. Several streaming providers have already increased monthly and/or annual subscription rates, continuing
a disappointing trend
from the past few years, with no foreseeable end.
Years of pricing and value concerns
Subscribers have generally seen an uptick in how much money they spend to access streaming services. In June,
Forbes
reported that 44 percent of the 2,000 US streaming users it surveyed who “engage with content for at least an hour daily” said their streaming costs had increased over the prior year.
Deloitte's
2024 Digital Media Trends
report found that 48 percent of the 3,517 US consumers it surveyed said that they would cancel their favorite streaming video-on-demand service if the price went up by $5.
Similarly, in a blog post about 2025 streaming trends, consumer research firm
GWI
reported that 52 percent of US TV viewers believe streaming subscriptions are getting too expensive, “which is a 77 percent increase since 2020.” A GWI spkesperon told me that the data comes from GWI's flagship dataset and surveying people from over 50 global markets. Its methodology is available
here
.) GWI added that globally, the top reason cited by customers who have canceled or are considering canceling a streaming service was cost (named by 39 percent of consumers), followed by price hikes (32 percent).
In its Digital Video Forecast and Trends Q1 2025 report, eMarketer (a marketing, ads, and commerce research firm that merged with Insider Intelligence in 2020) found that subscription fees for ad-free streaming tiers “have greatly outpaced inflation and pay TV increases since 2023,” as shown in the graph below:
Credit:

          
          eMarketer
“Pay TV packages and inflation have increased at similar rates in recent years. But over the past two years, streaming has gotten much more expensive relative to both,” eMarketer’s report says."
