url,title,date,desc
https://arstechnica.com/apple/2025/01/ios-18-3-beta-disables-news-notification-summaries-after-high-stakes-errors/,iOS 18.3 beta disables news notification summaries after high-stakes errors,2025-01-17,"Apple released new beta versions of iOS 18.3 to developers and the public yesterday, and one of the changes coming with the new software update will (at least temporarily) disable Apple Intelligence notification summaries for all apps in the App Store's News and Entertainment category, at least temporarily.
Apple said
earlier this month
that it would be instituting updates to how these notifications are handled after complaints from news organizations, and the company has apparently decided to turn them off entirely while it decides what those updates will look like. Most prominently, one user's notification summary from the BBC suggested that Luigi Mangione, the alleged killer of UnitedHealthcare CEO Brian Thompson, had died of suicide; this was not true.
Other examples
have been cropping up since then.
For the notification summaries that remain, Apple is instituting changes to make it clearer when users are reading summaries and to make it easier to turn those summaries off. Notification summaries in iOS 18.3 will be italicized to help further distinguish them from individual non-summarized notifications—before, there was a small icon next to the text to indicate you were looking at a summary. Apple is also making it possible to turn off summaries on a per-app basis directly from the lock screen without diving into the Settings app to do it."
https://arstechnica.com/ai/2025/01/google-increases-workspace-plan-base-prices-while-adding-gemini-features/,Google is about to make Gemini a core part of Workspaces—with price changes,2025-01-16,"Google has added AI features to its regular Workspace accounts for business while slightly raising the baseline prices of Workspace plans.
Previously, AI tools in the Gemini Business plan were a $20 per seat add-on to existing Workspace accounts, which had a base cost of $12 per seat without. Now, the AI tools are included for all Workspace users, but the per-seat base price is increasing from $12 to $14.
That means that those who were already paying extra for Gemini are going to pay less than half of what they were—effectively $14 per seat instead of $32. But those who never used or wanted Gemini or any other newer features under the AI umbrella from Workspace are going to pay a little bit more than before.
Features covered here include access to Gemini Advanced, the NotebookLM research assistant, email and document summaries in Gmail and Docs, adaptive audio and additional transcription languages for Meet, and ""help me write"" and Gemini in the side panel across a variety of applications.
Google says that it plans ""to roll out even more AI features previously available in Gemini add-ons only."""
https://arstechnica.com/gadgets/2025/01/the-editors-weaves-wikipedias-volunteers-into-a-global-suspense-tale/,The Editorsweaves Wikipedia’s volunteers into a global suspense tale,2025-01-16,"Yesterday was Wikipedia Day, celebrating
the first edit made to the online encyclopedia
on January 15, 2001. It's a tricky kind of celebration because, for many of us, every day is a Wikipedia Day. Scanning a new Wikipedia tab can feel like turning on a faucet, using a resource that has seemingly always been there and dispensed evenly, almost magically, from the Internet pipes.
But that's not where Wikipedia comes from. It comes from editors, who are volunteers that add missing topics, update pages when new things happen, and settle debates ranging from grammar ticks to deep philosophy. Author Stephen Harrison has
written about these people
for Slate, WIRED, The Guardian, and The New York Times. Now, he's exploring the distinctive lives, interests, and conflicts of this tribe in a fiction tome,
The Editors
.
The Editors
follows Morgan Wentworth, a recently laid-off journalist who scopes out a freelance story at a global conference for the book's Wiki stand-in, Infopendium. Wentworth sees the breadth of ages, personalities, and motivations among the editors and comes to appreciate their dedication. Then, a hacker breaks in, posts a cryptic message, and triggers Wentworth's expanding investigation into a global struggle over truth and information.
I spoke with Harrison about his work writing about Wikipedia, his approach to fiction as a tool for exploring the humans behind the site, where he thinks Wikipedia is now, and where it might be headed. The interview has been condensed and edited for length and clarity.
Ars: Out of everything in Wikipedia that you've written about, what made you want to explore the people,
The Editors
?
Harrison: I was kind of reporting on what the editors are doing or deciding upon, the debates they're having. But there's something about fiction—one of the strengths is that you can get inside the characters' heads. And I just thought that fiction was the best vehicle for that. …"
https://arstechnica.com/gadgets/2025/01/sonos-ousts-executive-blamed-for-rushing-botched-app-update/,"After CEO exit, Sonos gets rid of its chief product officer, too",2025-01-14,"A day after announcing that
CEO Patrick Spence is departing
the company, Sonos revealed that Chief Product Officer Maxime Bouvat-Merlin is also leaving. Bouvat-Merlin has been CPO since 2023.
As first reported by
Bloomberg
, Sonos will not fill the chief product officer role. Instead, Tom Conrad, the interim CEO Sonos announced yesterday, will take on the role's responsibilities. In an email to staff cited by Bloomberg (you can read the letter in its entirety at
The Verge
), Conrad explained:
With my stepping in as CEO, the board, Max, and I have agreed that my background makes the chief product officer role redundant. Therefore, Max’s role is being eliminated and the product organization will report directly to me. I’ve asked Max to advise me over the next period to ensure a smooth transition and I am grateful that he’s agreed to do that.
In May, Sonos released an update to its app that led to customers, many of them long-time users, revolting over broken features, like accessibility capabilities and the ability to set timers. Sonos expects that remedying the app and Sonos' reputation will cost it at least
$20 million to $30 million.
As head of the company, Spence received a lot of blame and has also been criticized for not apologizing for the problems
until July
. However, numerous reports have also attributed blame to Bouvat-Merlin."
https://arstechnica.com/gadgets/2025/01/amid-a-flurry-of-hype-microsoft-reorganizes-entire-dev-team-around-ai/,"Amid a flurry of hype, Microsoft reorganizes entire dev team around AI",2025-01-14,"Microsoft CEO Satya Nadella has
announced
a dramatic restructuring of the company's engineering organization, which is pivoting the company's focus to developing the tools that will underpin agentic AI.
Dubbed ""CoreAI - Platform and Tools,"" the new division rolls the existing AI platform team and the previous developer division (responsible for everything from .NET to Visual Studio) along with some other teams into one big group.
As for what this group will be doing specifically, it's basically everything that's mission-critical to Microsoft in 2025, as Nadella tells it:
This new division will bring together Dev Div, AI Platform, and some key teams from the Office of the CTO (AI Supercomputer, AI Agentic Runtimes, and Engineering Thrive), with the mission to build the end-to-end Copilot & AI stack for both our first-party and third-party customers to build and run AI apps and agents. This group will also build out GitHub Copilot, thus having a tight feedback loop between the leading AI-first product and the AI platform to motivate the stack and its roadmap.
To accomplish all that, ""Jay Parikh will lead this group as EVP."" Parikh was hired by Microsoft in October; he previously worked as the VP and global head of engineering at Meta.
The fact that the
blog post
doesn't say anything about .NET or Visual Studio, instead emphasizing GitHub Copilot and anything and everything related to agentic AI, says a lot about how Nadella sees Microsoft's future priorities.
So-called AI agents are applications that are given specified boundaries (action spaces) and a large memory capacity to independently do subsets of the kinds of work that human office workers do today. Some company leaders and AI commentators believe these agents will outright replace jobs, while others are more conservative, suggesting they'll simply be powerful tools to streamline the jobs people already have."
https://arstechnica.com/gadgets/2025/01/parallels-desktop-gains-really-slow-support-for-x86-oses-on-apple-silicon/,Parallels can finally run x86 versions of Windows or Linux on Apple Silicon,2025-01-14,"Virtualization software like Parallels and
VMware Fusion
give Mac owners the ability to run Windows and Linux on top of macOS, but for Apple Silicon Macs, that support was limited to the Arm-based versions of those operating systems. And while Windows and Linux both support some level of x86-to-Arm app translation that attempts to maintain compatibility with most software, there are still plenty of things that demand an Intel or AMD processor with the x86 instruction set.
Last week, Parallels
released a new update
that partially resolves this problem: Users of Parallels Desktop Pro 20.2.0 now have access to x86 operating systems via an ""early technology preview"" of Parallels' ""proprietary emulation engine.""
The technology preview is currently limited to certain 64-bit versions of Windows 10, Windows 11, and Windows Server 2019 and 2022. Parallels also says it has tested several UEFI-compatible Linux distributions, including Ubuntu 22.04.5, Kubuntu 24.04.1, Lubuntu 24.04.1, and Debian versions 12.4 to 12.8. Fedora will install, but it's unstable. 32-bit versions of operating systems, as well as older versions of Windows like Windows 7 or 8, aren't supported.
Parallels running the x86 version of Windows 10 on an M1 MacBook Pro. Parallels' virtual CPU appears to identify itself as a 5th-generation Intel Core laptop processor.
Credit:

          
          Parallels
For Windows 11 and supported Linux distros, you can run existing virtual machines using the technology preview, but you can't set up new ones—useful for anyone migrating from an Intel Mac with virtual machines they'd like to keep. If you're trying to set up a new virtual machine, the only officially supported operating systems are Windows Server 2022 and Windows 10 21H2, though there are
workarounds available
for Windows 10 22H2 and Windows Server 2019.
You won't be able to set up fresh copies of Windows 11 or some versions of Linux because the technology preview doesn't support SSE4.2, additional CPU instructions that became common in Intel and AMD processors in the early 2010s. This also means that Windows 11 24H2 VMs are entirely unsupported, since the 24H2 update
requires these CPU instructions to work at all
."
https://arstechnica.com/gadgets/2025/01/allstate-sued-for-allegedly-tracking-drivers-behavior-through-third-party-apps/,Lawsuit: Allstate used GasBuddy and other apps to quietly track driving behavior,2025-01-14,"Texas has sued insurance provider Allstate, alleging that the firm and its data broker subsidiary used data from apps like GasBuddy, Routely, and Life360 to quietly track drivers and adjust or cancel their policies.
Allstate and Arity, a ""mobility data and analytics"" firm founded by Allstate in 2016, collected ""trillions of miles worth of location data"" from more than 45 million people, then used that data to adjust rates, according to Texas' lawsuit. This violates Texas' Data Privacy and Security Act, which requires ""clear notice and informed consent"" on how collected data can be used. A statement from Texas Attorney General Ken Paxton said the suit is the first-ever state action targeting comprehensive data privacy violations.
“Our investigation revealed that Allstate and Arity paid mobile apps millions of dollars to install Allstate’s tracking software,” Paxton said in a statement. “The personal data of millions of Americans was sold to insurance companies without their knowledge or consent in violation of the law. Texans deserve better, and we will hold all these companies accountable.”
Latitude, longitude, and future rates
According to
Texas' complaint
(PDF), the data collected included ""a phone's geolocation data, accelerometer data, magnetometer data, and gyroscopic data, which monitors details such as the phone's altitude, longitude, latitude, bearing, GPS time, speed, and accuracy."""
https://arstechnica.com/gaming/2025/01/report-after-many-leaks-switch-2-announcement-could-come-this-week/,"Report: After many leaks, Switch 2 announcement could come “this week”",2025-01-13,"Nintendo may be getting ready to make its Switch 2 console official. According to ""industry whispers""
collected by Eurogamer
, as well as
reporting
from The Verge's Tom Warren, the Switch 2 could be formally announced sometime this week. Eurogamer suggests the reveal is scheduled for this Thursday, January 16.
The reporting also suggests that the reveal will focus mostly on the console's hardware design, with another game-centered announcement coming later. Eurogamer reports that the console won't be ready to launch until April; this would be similar to Nintendo's strategy for the original Switch, which was announced in mid-January 2017 but not launched until March.
Many things about the Switch 2's physical hardware design have been thoroughly leaked at this point, thanks mostly to accessory makers who have been showing off their upcoming cases. Accessory maker Genki was at CES last week with
a 3D-printed replica of the console
based on the real thing, suggesting a much larger but still familiar-looking console with a design and button layout similar to the current Switch.
On the inside, the console is said to sport a new Nvidia-designed Arm processor with a much more powerful GPU and more RAM than the current Switch. Dubbed ""T239,"" Eurogamer reports that the chip includes 1,536 CUDA cores based on the Ampere architecture, the same used in 2020's GeForce RTX 30-series graphics cards on the PC."
https://arstechnica.com/gadgets/2025/01/sonos-ceo-behind-disastrous-app-exits-with-1-9-million-severance/,Sonos CEO behind disastrous app exits with $1.9 million severance,2025-01-13,"After an app update rollout that can best be described as disastrous, Sonos is seeking a new CEO. The company announced today that Patrick Spence, who had been CEO for eight years, is stepping down.
In its announcement, Sonos said its board of directors and Spence ""agreed"" on the decision while saying it was unrelated to the company's fiscal Q1 2025 earnings, which it will report next month.
Spence joined Sonos as chief commercial officer in 2012 after leaving Blackberry. Under his tenure, Sonos branched into new categories, including portable speakers and spatial audio. But in May, Sonos issued an app update that broke basic and critical features.
Sonos employees
said the update was built on outdated code and infrastructure, impacting users' ability to do things like access and manage local libraries, set sleep timers, and edit song queues and playlists.
The employees also said the app was rushed so that it could be ready in time for Sonos' first wireless headphones,
Ace
. In July, following much public backlash,
Spence apologized
and promised regular updates until the new app was as good as the
old app
. But even today, users are
still reporting problems
with the software.
In August, Spence said Sonos would spend
$20 million to $30 million
""in the short term"" to fix the app. Soon after,
Sonos laid off 100 people
. Sonos' stock price declined approximately 13 percent since the app update,
Bloomberg
noted. Sonos execs, including Spence, received a $72,000 bonus in 2023 but
did not get bonuses
for the fiscal year that ended on September 30.
Spence will receive a cash severance of $1,875,000, per SEC filings. He will also get $7,500 per month and serve as a Sonos board advisor until June, and his unvested shares will vest.
Tom Conrad, who has been on Sonos' board since 2017, took the role of interim CEO today. Sonos plans on having a new CEO by February via the help of a third-party firm. In the meantime, Conrad will get $175,000 per month and receive $2.65 million in stock shares."
https://arstechnica.com/gadgets/2025/01/three-bizarre-home-devices-and-a-couple-good-things-at-ces-2025/,Three bizarre home devices and a couple good things at CES 2025,2025-01-11,"Every year, thousands of product vendors, journalists, and gadget enthusiasts gather in an unreasonable city to gawk at mostly unrealistic products.
To be of service to our readers, Ars has done the work of looking through hundreds of such items presented at the 2025 Consumer Electronic Show, pulling out the most bizarre, unnecessary, and head-scratching items.
Andrew Cunningham swept across PC and gaming accessories
. This writer stuck to goods related to the home.
It's a lie to say it's all a prank, so I snuck in a couple of actually good things announced during CES for human domiciles. But the stuff you'll want to tell your family and friends about in mock disbelief? Plenty of that, still.
AI-powered spice dispenser: Spicerr
Credit:

          
          Spicerr
Part of my job is to try to expand my viewpoint—to encompass people who might not have the same experiences and who might want different things from technology. Not everybody is a professional writer, pecking away in Markdown about the latest turn-based strategy game. You must try to consider many viewpoints when addressing new products and technologies.
I cannot get there with
Spicerr
, the ""world's first AI-powered spice dispenser,"" even leaving aside the AI bit. Is the measurement and dumping of spices into a dish even five percent of the overall challenge? Will a mechanical dispenser be any more precise than standard teaspoons? Are there many kinds of food on which you would want to sprinkle a ""customized blend"" of spices? Are there home cooks so dedicated to fresh, bright flavors that they want their spices delivered in small vials, at presumably premium prices, rather than simply having small quantities of regularly restocked essentials?
Maybe the Spicerr would be a boon to inexperienced cooks, whose relatives all know them to under-season their food. Rather than buying their mediocre chef a battery-powered device to ""take the guesswork out of seasoning,"" they could perhaps instead buy them good cookbooks or a Times Cooking subscription or just a few new bottles of paprika, oregano, cumin, cayenne, and turmeric."
https://arstechnica.com/gadgets/2025/01/strange-unique-and-otherwise-noteworthy-pcs-and-pc-accessories-from-ces-2025/,"Strange, unique, and otherwise noteworthy PCs and PC accessories from CES 2025",2025-01-10,"The Consumer Electronics Show is a reliable source of announcements about iterative updates to PCs and PC components. A few of those announcements are significant enough in some way that they break through all that noise—
Nvidia's RTX 50-series GPUs
and their lofty promises about AI-generated frames did that this year, as did Dell's decision
to kill multiple decades-old PC brands
and replace them with a bland series of ""Pro/Premium/Plus"" tiers.
But CES is also a place where PC companies and accessory makers get a little weird, taking some bigger (and occasionally questionable) swings alongside a big batch of more predictable incremental refreshes. As we've covered the show from afar this year, here are some of the more notable things we've seen.
Put an E-Ink screen on it: Asus NUC 14 Pro AI+
The NUC 14 Pro AI+ finds a way to combine E-Ink, AI, and turn-of-the-millennium translucent plastic into a single device.
Credit:

          
          Asus
The strangest CES PCs are usually the ones that try to pull away from ""a single screen attached to a keyboard"" in some way. Sometimes, those PCs have
a second screen stashed somewhere
; sometimes, they have a screen that stretches; sometimes, they get rid of the keyboard part and
extend the screen down
where you expect that keyboard to be.
Asus is currently the keeper of Intel's old NUC mini PC line, and this year it's updating the NUCs mostly by putting new processors in them. But the Asus NUC 14 Pro AI+ also decides to spice things up by adding a color E-Ink display on top, one with images that can display persistently even when the device is off.
While
other PCs with shoehorned-in E-Ink displays
have at least tried to do something functional—older laptops in Lenovo's ThinkBook Plus series could be used as E-Ink tablets when they were closed—the screen on the NUC 14 Pro AI+ seems strictly ornamental. Asus offers few details about how it works: ""users can generate AI images through the built-in app, allowing them to create unique personal identification designs that continuously display content without being plugged in, consuming no power."""
https://arstechnica.com/gadgets/2025/01/suing-wi-fi-router-makers-remains-a-necessary-part-of-open-source-license-law/,German router maker is latest company to inadvertently clarify the LGPL license,2025-01-10,"The GNU General Public License (GPL) and its ""Lesser"" version (LGPL) are widely known and used. Still, every so often, a networking hardware maker has to get sued to make sure everyone knows how it works.
The latest such router company to face legal repercussions is
AVM
, the Berlin-based maker of the most popular home networking products in Germany. Sebastian Steck, a German software developer, bought an
AVM Fritz!Box 4020
(PDF) and, being a certain type, requested the source code that had been used to generate certain versions of the firmware on it.
According to Steck's complaint (translated to English and
provided in PDF
by the Software Freedom Conservancy, or SFC), he needed this code to recompile a networking library and add some logging to ""determine which programs on the Fritz!Box establish connections to servers on the Internet and which data they send."" But Steck was also concerned about AVM's adherence to GPL 2.0 and LGPL 2.1 licenses, under which its FRITZ!OS and various libraries were licensed. The SFC states that it provided a grant to Steck to pursue the matter.
AVM provided source code, but it was incomplete, as ""the scripts for compilation and installation were missing,"" according to Steck's complaint. This included
makefiles
and details on environment variables, like ""KERNEL_LAYOUT,"" necessary for compilation. Steck notified AVM, AVM did not respond, and Steck sought legal assistance, ultimately including the SFC.
Months later, according to the SFC, AVM provided all the relevant source code and scripts, but the suit continued. AVM ultimately paid Steck's attorney fee. The case proved, once again, that not only are source code requirements real, but the LGPL also demands freedom, despite its ""Lesser"" name, and that source code needs to be useful in making real changes to firmware—in German courts, at least."
https://arstechnica.com/gadgets/2025/01/disney-fox-and-wbd-give-up-on-controversial-sports-streaming-app-venu/,"Disney, Fox, and WBD give up on controversial sports streaming app Venu",2025-01-10,"Venu Sports
, the sports streaming app that Fox, Disney, and Warner Bros. Discovery (WBD) announced as part of a joint venture in February, will no longer launch, the three companies said today.
The app was supposed to give subscribers access to all three conglomerates' linear channels that show sports, including ABC, Fox, ESPN, FS1, and TruTV. Original content wasn’t expected to launch with the app, but the joint multichannel video programming distributor was expected to represent about 85 percent of the US sports rights market. The app was planned to cost $43 per month.
In a joint statement shared today, the companies said:
After careful consideration, we have collectively agreed to discontinue the Venu Sports joint venture (JV) and not launch the streaming service. In an ever-changing marketplace, we determined that it was best to meet the evolving demands of sports fans by focusing on existing products and distribution channels. We are proud of the work that has been done on Venu to date and grateful to the Venu staff, whom we will support through this transition period.
The news follows concerns from various rivals, sports rights holders, and other critics that the JV would be too powerful and represents an antitrust violation.
Shortly after the February announcement of Venu, Fubo, a sports streaming service, filed an
antitrust suit against the new venture
. Among its claims was that the companies behind Venu forced price hikes onto companies like Fubo by bundling unwanted, irrelevant content with desired sports content. Fubo eventually won a
temporary injunction against Venu's
launch ahead of a trial originally scheduled for October 2025.
But on Monday, Fubo announced that its litigation against the three companies was settled and that
Fubo is merging with Disney’s Hulu + Live TV
service. Under the terms of the acquisition, Disney would own 70 percent of Fubo, and Fubo would receive an aggregate cash payment of $220 million from Disney, Fox, and WBD when the deal closes.
The Hollywood Reporter
reported that the deal is expected to take 12 to 18 months to close. Disney and Fubo haven't announced any changes to their merger plans following today's announcement."
