category,media_company,title,date,content,comment_count,image,url
사회,뉴시스,"안양 스마트도시통합센터, '진로 체험 인증기관'에 선정",2024.12.27. 오후 4:37,"자율주행, 빅데이터, 인공지능, 사물인터넷 등 미래 기술 체험[안양=뉴시스] 안양시 스마트도시통합센터 홍보 체험관 전경.(사진=안양시 제공). 2024.12.27.photo@newsis.com[안양=뉴시스] 박석희 기자 = 경기 안양시는 관내 스마트도시통합센터(동안구 평촌대로243번길 42)가 교육부와 대한상공회의소가 주관하는 2024년 하반기 ‘교육 기부 진로 체험 인증기관’에 선정됐다고 27일 밝혔다.이날 안양시에 따르면 2016년부터 시작된 교육 기부 진로 체험 인증제는 전국 초·중·고 학생을 대상으로 양질의 진로 체험을 무료로 제공하는 기관에 교육부 인증을 부여하는 제도다.인증기관에는 3년간의 인증 효력과 함께 교육부 장관 명의의 인증서와 대외홍보에 활용할 수 있는 인증마크 사용 권한을 준다. 현재 전국에서 총 2771개 기관이 운영되고 있다.이와 함께 안양시 스마트도시통합센터는 내년 1월부터 자율주행·빅데이터·인공지능(AI)·사물인터넷(IoT) 등 다양한 미래 기술을 체험할 수 있는 현장 견학형 진로 체험 행사를 운영한다.프로그램은 대표적으로 안양시가 운영하는 자율주행 버스 ‘주야로’ 탑승, 자율주행 시뮬레이터, 디오라마, 스마트 도로, 가상현실(VR)·확장현실(XR) 체험 등으로 구성됐다.24시간 운영하는 도시 안전·재난 모니터링 시스템을 한눈에 볼 수 있는 통합 관제센터 견학도 프로그램에 포함됐다.최대호 시장은 “청소년들이 다양한 4차 산업기술을 체험하고 이를 통해 새로운 꿈과 목표를 발견할 수 있도록 프로그램 운영에 최선을 다하겠다""고 말했다.한편 각 인증기관에서 제공하는 다양한 정보는 '꿈길'(www.ggoomgil.go.kr)을 통해 확인할 수 있다, 관심 있는 학교는 이를 통해 확인하고 신청하면 된다. 안양시는 스마트도시통합센터(031-8045-5252)에서도 안내한다.",No comment found,No image,https://n.news.naver.com/mnews/article/003/0012984838?sid=102
사회,더팩트,"부천시, 면접정장 무료 대여 내년 1월 6일 재개",2024.12.27. 오후 3:04,"부천시 거주자·부천 소재 학교 재학생 누구나 지원 가능면접정장 무료 대여사업 안내문./부천시경기 부천시는 면접정장 무료 대여사업을 내년 1월 6일부터 다시 시작한다고 27일 밝혔다.구직을 원하는 부천시 거주자와 부천 소재 학교 재학생이라면 누구나 3박 4일간 최대 다섯 번까지 구두와 넥타이, 액세서리를 포함한 정장 세트를 무료로 대여할 수 있다.취업준비생의 구직비용을 줄여주기 위해 시작된 이 사업은 올해로 6년째며, 정장 대여소 2개소를 운영해 구직자의 편의를 더하고 있다. 지난해 무료 면접정장을 이용한 시민은 1146명이며, 이용 만족도가 약 97%에 달할 정도로 호응이 컸다.정장 무료대여 2호점인 ‘부천청년리더샵’은 대여는 물론 인공지능·가상현실 면접 체험, 일대일 맞춤형 컨설팅, 화상 면접장 연계 등 원스톱 취원지원 서비스도 제공하고 있다.부천시 관계자는 ""어려운 경제 여건에도 취업을 위해 열심히 노력하는 분들을 위한 다양한 지원책을 준비하고 있다""면서 ""면접정장 대여는 물론 컨설팅, 다양한 면접체험 등 맞춤형 지원프로그램으로 취업하기 좋은 부천시를 만드는 데 최선을 다하겠다""고 말했다.대여장소는 △벨레토(중동 위브더스테이트 1단지 230호) △부천청년리더샵(송내역 1층 2번출구)이다. 대여 준비물은 신분증, 워크넷 구직 등록번호, 면접 증빙자료다.발로 뛰는 더팩트는 24시간 여러분의 제보를 기다립니다.▶카카오톡: '더팩트제보' 검색▶이메일: jebo@tf.co.kr▶뉴스 홈페이지: http://talk.tf.co.kr/bbs/report/write",No comment found,No image,https://n.news.naver.com/mnews/article/629/0000351644?sid=102
생활,이코노미스트,"벤츠, E클래스 명성 ‘E200 아방가르드’로 잇는다",2024.12.27. 오후 3:09,"합리적 가격으로 접근성 높인 E200KNCAP 최고 점수 획득, 최우수상 수상메르세데스-벤츠 E 200 아방가르드 [사진 메르세데스-벤츠][이코노미스트 박세진 기자] 메르세데스-벤츠의 준대형 세단 ‘E클래스’가 국내 수입차 시장에서 여전히 인기 있는 차종으로 꼽히고 있다. 그 중 벤츠 E200 아방가르드의 약진이 눈에 띤다.E클래스는 국내 수입차 시장에서 지난 8년간 1위 자리를 지켜왔다. 트렌드의 영향을 받지않고 한국 시장에서 벤츠의 입지를 공고히 다지는 모델이 E클래스인 셈이다.이 중 지난 5월 출시한 엔트리 모델 E200의 존재감도 크다. E200 아방가르드는 합리적인 가격을 바탕으로 높은 접근성을 보인다. E200 아방가라드의 판매가격은 7390만원부터 시작한다.E200은 출시 이후 트림별 순위 6위에 오른 7월을 제외하고는 매월 톱 5에 이름을 볼렸다. 지난 11월 기준 트림별 누적 판매순위에서도 상위 5위권 안에 안착했다.E200의 안전도도 눈길을 끈다. E200은 한국교통안전공단 자동차연구안전연구원이 진행한 ‘2024 자동차안전도 평가’(KNCAP) 3개 분야에서 최고 종합점수를 획득해 최우수상을 수상한 바 있다.E클래스의 외관의 특징은 ‘전통’과 ‘현대’의 조화다. 아방가르드모델은 라디에이터그릴에 메르세데스-벤츠 삼각별을 형상화한 스타패턴과 크롬테두리가 적용됐다. 그릴 중앙에는 엠블럼이 위치해 있는데, 이는 입체적인 느낌을 제공한다.차량은 짧은 프론트 오버행과 긴보닛의조합으로 제작됐다. 안정감 있는 벨트라인 실루엣과 보닛 위 파워돔으로 역동성을 강조했다. 아울러 A-필러를 뒤에 위치하도록 한 ‘캡-백워드’(cab-backward) 디자인을 적용해 모던한 분위기를 형성하고, 부드럽게 흐르는 듯 한 C-필러라인과 18인치 5스포크 알로이휠을 적용했다.E200 아방가르드에는 어댑티브하이빔어시스트(Adaptive High Beam Assist)를 포함한 LED 고성능 헤드램프가 기본 탑재됐다. 리어램프에는 독특한 삼각별 엠블럼의 스타 패턴 디자인이 적용됐다.메르세데스-벤츠 E200 아방가르드 인테리어. [사진 메르세데스-벤츠]넓고 정숙한 실내공간E-클래스의 휠베이스는 국내 인증 기준 이전 세대 보다 20mm 더길어졌다. 이를 바탕으로 보다 여유로운 실내 공간을 제공한다. 아울러 운전석 헤드룸은 5mm, 뒷 좌석 레그룸은 최대17mm 증가했다. 뒷 좌석 너비도 25mm 증가한 1159mm로 S-클래스 수준에 가까워졌다. 트렁크에는 최대 540L 까지 적재가능하다.이와 함께 소음 저감을 위한 다양한 노력도 가미됐다. 보닛 측면 실링, 앞바퀴 및 뒷바퀴 특수 스포일러, 플러시도어 핸들 등 공기 역학적 디자인요소를 갖춰 공기저항계수 0.23Cd를 기록했다. 여기에 도어 및 윈도우 실링과 방음재 등을 활용해 외부 풍절음을 최소화했다.E200 아방가르드는 실내 디스플레이로 14.4인치 고해상도 LCD 중앙 디스플레이를 제공한다. 햅틱 피드백 기술도 적용돼 운전자가 직관적이고 편리하게 조작 할 수있다. 차량에탑재된3세대 MBUX 인포테인먼트 시스템은 개선된 디지털 경험을제공한다.이에 더해, 운전자가 반복적으로 사용 하는 편의 기능을 자동화하는 ‘루틴’(routine)도 추가됐다. 운전자는 표준 루틴 템플릿을 사용 할 수 있고, 스스로 루틴을 생성 할 수도있다. 이를 통해 온도 설정, 앰비언트라이트, 오디오, 주차 카메라 등의 차량 기능을 날짜 및 시간, 위치, 내외부온도, 차량 속도 등 자신이 원하는 특정 조건과 연결해 반복적으로 사용할 수 있다.E200 아방가르드는 4기통 가솔린엔진(M254)를 장착해 최대출력 204PS(마력), 최대토크32.6 kgf·m를 제공한다. 차량에는 48V 마일드 하이브리드시스템이 탑재됐다. 2세대 통합 스타터 제너레이터를 통해 엔진에 추가적인 전기 공급으로 가속시 최대 17kW의 힘을 제공해 효율적인 주행을 돕는다.이 밖에도 ▲MBUX 증강 현실 내비게이션 ▲무선 애플카플레이 및 안드로이드오토 ▲앞좌석무선충전 ▲파노라믹선루프 ▲앞좌석열선및통풍시트 ▲뒷좌석열선시트 ▲열선스티어링휠 ▲핸즈프리액세스 ▲전동트렁크등 여러 옵션들이 기본으로 제공된다.",0,https://imgnews.pstatic.net/image/119/2024/12/27/0002908205_001_20241227080009705.png?type=w860,https://n.news.naver.com/mnews/article/008/0005133754?sid=105
생활,코메디닷컴,호스피스 환자에게 적합한 구강관리 방법은?,2024.12.27. 오후 2:28,"[김현정의 입속 탐험][사진=게티이미지뱅크]호스피스 케어의 목적은 삶의 마지막까지 삶의 질을 유지하는 데 있습니다. 의사는 여명이 6개월 이내인 환자들이 적극적 치료를 중단하고, 고통을 최소화하여 삶을 마무리하도록 도와줍니다. 세계보건기구(WHO)는 호스피스 완화의료를 '생명을 위협하는 질병과 관련된 문제에 직면한 환자와 그 가족의 삶의 질을 개선하고 통증과 기타 신체적, 심리사회적, 영적 문제를 조기에 식별하고 완벽하게 평가하고 치료함으로써 고통받는 삶을 예방하는 접근방식""이라고 정의하고 있습니다.구강관리는 많은 영역에서 무시되기 쉽습니다. 특히 호스피스 케어에서 돌봄 제공자들은 환자의 위중한 상태로 말미암아 구강관리에 대한 중요도를 낮게 평가하는 경우가 있습니다. '여명이 몇 개월인데 이렇게까지 해야 하나?'라는 생각을 하거나, 완화의료에서 구강관리가 우선 순위에서 밀리는 현실에 직면합니다. 이러한 상황은 급여 제공의 공백, 돌봄 제공자들의 시간적 제약, 호스피스 환자에게 구강관리를 어떻게 어디까지 제공해야 하는 지에 대한 교육의 부족 등에서 비롯됩니다. 호스피스 환자에게 적절한 구강관리를 주저하거나 필요한 경우에도 치과치료를 위한 적극적 개입을 하지 않는 것이 현실입니다. 호스피스 케어에서 구강관리의 주요 목적은 입마름 등 구강 불편감을 개선하고, 구내염을 관리하며, 그리고 좋지 않은 구강위생으로 인한 흡인성 폐렴 등을 예방하는 데 있습니다.그렇다면 자립적인 호스피스 환자가 정기적인 구강검진과 구강관리를 계속해야 하는 이유는 무엇일까요? 구강건강이 나쁘면 영양상태, 편안함, 사회적 관계 등에 부정적인 영향을 미쳐 삶의 질이 떨어지기 때문입니다. 특히 입이 마르고 구강위생이 나쁜 호스피스 환자들은 치주질환에 더욱 취약합니다. 잇몸 관리를 통해 환자가 편안해지고 영양상태가 좋아지고 구강병과 흡인성 폐렴 등의 발생을 줄일 수 있습니다. 흡인성 폐렴과 뇌심혈관질환, 당뇨병, 암 등은 구강건강 모니터링 및 관리를 소홀히 하여 생기는 만성치주염 중증도와 연관되어 있습니다.면역 기능이 저하된 호스피스 환자의 85%에서 구강 칸디다증이 발견되며, 이는 심각한 구강건조증의 결과입니다. 때문에 호스피스 환자들에게 적절한 입마름 케어를 제공하는 것은 매우 중요합니다. 호스피스 환자들은 캔디다 구내염, 구강건조증, 충치, 치주질환, 식욕부진, 삼킴곤란, 호흡 곤란 및 의사소통 곤란 등 다양한 어려움을 겪습니다. 적극적인 구강관리를 제시한 호스피스 케어팀은 매일 3번 일반적인 구강세척과 교대 간호사의 정기적인 구강평가를 강조하고 있습니다.호스피스 구강관리는 치과치료의 완벽함을 추구하는 것은 아닙니다. 현장에서 환자 상황에 맞게 제공돼야 합니다. 더구나 호스피스 케어 현장 경험이 전무한 치과의사나 치위생사가 단지 전문가라는 이유로 전담해야 하는 것은 아닙니다. 오히려 다학제적 접근으로 치과전문가나 작업치료사들이 현장에 있는 돌봄 제공자들이 제대로 할 수 있게 '교육과정(Training of trainers)'을 제공하는 식 접근이 필요합니다.구강관리는 무엇보다도 환자의 편안함과 안전을 최우선으로 하여 맞춤형 구강관리를 해야 합니다. 기본적으로 매일 2~3회 구강관리를 해야 하며, 환자가 의식이 명료하고 구역반사가 있을 경우 부드러운 칫솔이나 거즈를 이용해 치아, 잇몸, 혀를 부드럽게 닦습니다. 그러나 환자들이 예민하고 구강 내 염증이나 통증이 있을 때에는 일상적인 칫솔질이나 치실, 치약 사용도 힘들 수 있습니다. 문헌에 따르면 생리식염수나 제라늄, 라벤더, 티트리, 페퍼민트 정유를 혼합한 용액을 사용하여 환자들의 구강 불편감을 완화시키기도 합니다. 입이 매우 마르거나 화끈거리면 냉수 가글링을 고려할 수 있지만 의식이 없으면 양치한 물이 폐로 넘어갈 수 있습니다. 이런 경우 많은 병동에서 칫솔질을 생략하고 부드러운 거즈로 구강을 닦기만 합니다. 외국에서는 레몬즙을 물에 섞어 입이 마른 환자들에게 스프레이해 주기도 합니다. 완화의료에서 구강관리는 환자의 개별적인 상태와 요구에 맞춰 구강관리 계획을 수립하고 실행하는 것이 중요합니다.그렇다면 호스피스 환자에게 적합한 구강관리 방법에는 어떤 것들이 있는지 질문해 보았습니다.결국, 호스피스 케어에서 구강관리를 정의하는 것은 환자의 삶의 질 증진과 관련된 공백 영역을 메꾸는 것입니다. 구강관리를 소홀히 하면 환자의 존엄성을 소홀히 하게 되고, 느슨하거나 썩은 치아, 염증으로 아픈 치아와 구강점막, 더 나아가 흡인성 폐렴의 조기 발견이 어렵습니다. 또한,  구강관리 시간에 입을 다물고 협조하지 않는 환자와 구강 통증이나 불편함을 말로 표현할 수 없는 환자들은 매일 하는 구강관리가 매우 어렵습니다.그럼에도 돌봄 제공자는 호스피스 환자의 구강문제를 마주해야 할 윤리적 책임이 있습니다. 특히 호스피스 완화의료 환자에서 볼 수 있는 복잡성은 일반화가 아니라 개별화된 맞춤형 구강관리가 절실히 필요합니다. 어떤 호스피스 환자에게는 유익하고 안전한 구강관리 방법일지라도 다른 환자에게도 반드시 유익하고 안전한 것은 아닙니다. 호스피스 환자가 요구하는 고유한 구강상태를 완화시킬 수 있는 구강관리방법을 교육하고 구현할 필요가 있습니다. 구강관리는 호스피스 환자의 존엄성과 완화의료의 목적을 위해 제공되는 필수적이고 기본적인 서비스입니다.<참고문헌>Soileau K, Elster N. The Hospice Patient's Right to Oral Care: Making Time for the Mouth. J Palliat Care. 2018 Apr;33(2):65-69. doi: 10.1177/0825859718763283. Epub 2018 Mar 13. PMID: 29533131.",0,https://imgnews.pstatic.net/image/119/2024/12/27/0002908205_001_20241227080009705.png?type=w860,https://n.news.naver.com/mnews/article/008/0005133754?sid=105
경제,비즈워치,"['25년 대출 전략은]대출금리, 얼마나 떨어질까",2024.12.27. 오전 11:02,"기준금리 인하에도 대출금리 인하폭 제한대출 총량 관리에 금리 경쟁 가능성 낮아은행권 대출 문턱이 다소 낮아지면서 대출이 가능해졌다. 그럼에도 금융 소비자들은 대출을 망설일 수밖에 없다. 한국은행 금융통화위원회가 침체된 내수를 살리기 위해 기준금리를 2회 연속 인하했지만 은행 대출금리는 요지부동인 까닭이다.최근 2~3년간 가파른 금리인상으로 차주들의 금융부담이 크게 높아진 가운데 대출금리가 조금이라도 낮아지기를 기대하고 있지만 현실은 다르다.시중은행들은 이자이익에 대한 거센 비판을 받고 있지만 대출금리를 낮추기는 쉽지 않다고 토로한다. 내년에도 가계대출 관리가 필요한 상황이라 이전처럼 고객을 빼앗고 빼앗기지 않기 위한 금리 경쟁은 펼쳐지기 어려운 여건이라는 설명이다./사진=이명근 기자 qwe123@기준금리 인하에도 대출금리 오른 이유금융권에 따르면 시중은행 주택담보대출 금리는 혼합형은 3.35~5.29%, 변동형은 3.08~6.14% 선에 형성돼있다. 약 2주 전과 비교해 금리가 0.1%포인트 이상 오른 상태다.한국은행 금통위는 지난 10월과 11월 기준금리를 2회 연속 인하했다. 현재 기준금리는 3%로 운영되고 있다.기준금리 인하에도 대출금리가 낮아지는 속도는 더디다. 은행들이 가계대출 관리를 위해 실수요자 중심 대출 공급정책을 유지하는 동시에 대출금리 인하에도 소극적인 까닭이다. 은행이 가산금리 조정을 통해 대출금리에 시장금리 인하 영향폭을 줄이면서 운영하고 있는 상황이다.여기에 국내 정치 리스크를 포함한 대내외 변수 영향으로 시장금리는 최근 상승하는 모습이다. 금융투자협회 채권정보센터에 따르면 은행채 5년물(AAA) 금리는 한은 금통위가 기준금리를 인하했던 지난 달 28일(3%)보다 오른 3.124%(12월24일 기준)를 기록했다.미국 연방준비제도(Fed)가 정책금리를 인하했지만 내년 통화정책을 보수적으로 운영하겠다는 매파적 기조를 밝힌 게 채권시장에 영향을 준 것으로 분석된다. 당초 시장에선 미 연준이 내년 정책금리를 4회 이상 인하할 것으로 예상했지만 FOMC(연방공개시장위원회) 회의 후 2회 인하 정도에 그칠 것으로 전망치를 수정했다. 은행 대출금리가 기준금리와 다른 방향으로 향한 이유다.금융당국은 차주들이 기준금리 인하 효과를 체감할 수 있도록 해야 한다는 점을 강조하고 있다.권대영 금융위원회 사무처장은 지난 11일 가계부채 점검회의에서 ""금융사들의 금리는 기본적으로 시증금리 흐름을 충실히 반영할 필요가 있다""며 ""금융사들이 가산금리 등 대출금리 산정체계를 점검하고 소비자에게 설명하는 노력이 필요하고, 금융당국도 필요하면 이를 살펴볼 것""이라고 말했다.이와 함께 이창용 한국은행 총재가 내년에도 기준금리 추가 인하를 시사했다. 은행들의 경우 기준금리가 인하되면 수신금리를 선제적으로 낮추고, 이로 인해 조달비용 부담이 줄면 대출금리도 인하한다. 향후 대출금리가 현 수준보다는 지속적으로 떨어질 것으로 예상된다.금리 경쟁 펼쳐질까이처럼 대출금리 인하 환경은 조성됐지만 차주를 포함한 금융 소비자들이 기대할 수준까지 낮아질지는 미지수다. 이전처럼 은행들이 금리 경쟁을 통해 고객 모시기에 나설 상황이 아닌 까닭이다.올 초만해도 온라인 대환대출 플랫폼을 통해 주택담보대출도 갈아타기가 가능해지자 인터넷전문은행을 시작으로 금리 경쟁이 펼쳐졌다. 반면 내년에는 금융당국이 올 하반기와 같은 가계부채 관리 기조를 이어가겠다는 방침이어서 은행들이 금리 경쟁을 통한 가계대출 늘리기에 나서기 어려운 상황이다.연초 세운 가계대출 관리 목표 아래 대출 공급량을 관리해야 하고, 특정 시기 쏠림 현상을 방지하기 위해서라도 대출금리를 선제적으로 인하하기 어렵다는 게 은행권 설명이다. 다른 은행보다 먼저 대출금리를 낮추면 특정 은행으로 소비자들이 몰릴 가능성이 크기 때문이다.한 시중은행 관계자는 ""대출금리를 먼저 낮추면 유입효과를 막을 수 없는 상황이라 조심스럽게 접근할 수밖에 없다""며 ""가계대출 숫자를 관리하려면 가격 경쟁(금리 경쟁)보다는 실수요자 위주로 강화됐던 대출 규제를 풀면서 추이를 지켜봐야 해 금리 인하는 맨 마지막 조치가 될 것으로 본다""고 말했다.또 다른 은행 관계자는 ""대출 자산이 늘지 않으면 금리 경쟁이 펼쳐질 수도 있겠지만 부동산 시장 상황 등을 보면서 결정해야 할 사안""이라며 ""올초와 같은 금리 경쟁이 치열해지기는 힘들고 선뜻 금리인하에 나서는 은행도 없을 가능성이 높다""고 설명했다.",0,https://imgnews.pstatic.net/image/119/2024/12/27/0002908205_001_20241227080009705.png?type=w860,https://n.news.naver.com/mnews/article/119/0002908205?sid=105
IT,머니투데이,"비싸고 무겁고 버그까지…애플 비전프로, 올 최대 'IT실패작'",2024.12.27. 오전 8:01,"[IT썰]애플 비전 프로(Apple Vision Pro) /사진=뉴스1올해 가장 실망스러운 IT기기로 애플의 MR(혼합현실) 헤드셋 '비전프로'가 꼽혔다.영국 IT매체 테크레이더는 지난 24일(현지시각) 전문가 평가와 이용자 설문조사를 종합해 '2024년 가장 큰 IT실패작' 11개를 선정했다. 이중 애플의 비전프로가 1위를 차지했다.테크레이더는 ""비전프로는 이용자 대상 '왓츠앱' 설문조사에서 전체 62% 투표를 기록했다""며 ""너무 비싸고 무겁고 앱에 버그가 있다는 점에 동의한다""고 진단했다. 아무리 좋은 시청각 경험을 제공해도 3500달러(약 514만원)는 부담스러운 가격인 데다, 일부 앱에서 오류가 발생하거나 킬러 앱이 없는 등 소프트웨어가 부족하다는 설명이다.테크레이더는 ""애플이 생각했던 것만큼 판매량이 늘지 않았고 앱 개발자들도 몰려들지 않았다""라며 ""매년 실시하는 맥(Mac) 개발자 설문조사에서 35%는 비전프로용 앱을 만들계획이 없다고 답했다""라고 말했다. 이어 ""비전프로는 어떤 면에선 훌륭한 제품일 수 있지만 높은 가격과 판매부진 지원부족이라는 측면에서 실패작이라는 사실을 부인할 수 없다""고 덧붙였다.",0,https://imgnews.pstatic.net/image/119/2024/12/27/0002908205_001_20241227080009705.png?type=w860,https://n.news.naver.com/mnews/article/119/0002908205?sid=105
