category,media_company,title,date,content,comment_count,image,url
IT,지디넷코리아,"[현장] ""공공·민간 경계 허문다""…NIA, 'AI 기반 사회현안 해결 세미나' 개최",2024.12.27. 오후 12:25,"민홍기 NIA 위원장 ""전자정부 선진성, AI 시대에도 이어가야""…행정 효율·국민 신뢰 강조""전자정부 분야에서 세계적 선도 역할을 해온 한국이 AI 시대에도 혁신을 이어가야 합니다. 단순한 업무 디지털화가 아닌 국민 체감도와 신뢰를 높이는 것이 핵심입니다.""민홍기 카이스트 김재철AI대학원 초빙교수 겸 한국지능정보원(NIA) 경영전략자문위원회 위원장은 27일 서울 중구 은행회관 국제회의실에서 열린 '제6회 AI 기반 사회현안 해결 세미나'에서 이같이 말했다. 이날 행사는 중앙부처·공공기관 관계자, 민간 전문가, 학계 인사들이 참석한 가운데 AI 기술을 통한 사회문제 해결과 공공부문 업무 혁신 방안을 심도 있게 논의했다.민 교수는 이번 세미나의 의의에 대해 ""미국과 영국이 추진하는 AI 행정 혁신이 전 세계에 큰 파장을 일으킬 수 있는 만큼 한국도 선제적 대응이 중요하다""며 ""트럼프 시대가 다시 열릴 경우 미국의 규제·예산 정책 변화가 행정 운영에 직접적으로 영향을 미칠 수 있다""고 강조했다.민홍기 카이스트 김재철AI대학원 초빙교수 겸 한국지능정보원(NIA) 경영전략자문위원회 위원장 (사진=조이환 기자)실제로 이날 첫 번째 발표를 맡은 이태준 교수는 '트럼프 2.0 시대 정부혁신, 지금 우리는?'을 주제로 발제를 진행하며 미국의 정권 교체에 따른 글로벌 AI 행정혁신 동향과 한국의 대응 전략을 제시했다.이 교수에 따르면 현재 정권 교체를 앞둔 미국은 규제 완화와 비용 절감을 내세워 공무원 인력을 재배치하거나 반복 업무를 AI로 최적화할 가능성이 크다. 이와 반대로 영국은 안정적인 AI 거버넌스 체계로 공공서비스 개선에 주력하게 될 것으로 예상된다.그는 ""국내에서도 디지털 및 데이터 활용이 활발해졌지만 아직 인재 양성·법제 정비·협업 문화 측면에서는 개선 여지가 크다""며 ""AI 테스트베드를 확대하고 범정부 차원에서 제도·규제를 재정비해 혁신 속도를 높여야 한다""고 조언했다.이어서 ""정부와 정치권, 공공기관, 민간기업이 함께 협력해야 한국이 아시아를 넘어 글로벌 AI 리더로 성장할 수 있다""고 강조했다.다음 순서로 김정욱 삼성SDS 상무가 'AI를 활용한 민간의 워크 트랜스포메이션과 공공부문을 위한 제언'을 주제로 발표를 이어갔다. 김 상무는 현재 민간기업이 생성형 AI를 활용해 사무직 업무 효율을 획기적으로 높이고 있다며 회의록 자동화, 고객 상담 챗봇, 특허 검토 등 다양한 활용 사례를 소개했다.AI기반 공공부문 워크 트랜스포메이션 세미나 (사진=NIA)김 상무는 ""계약, 보안, 데이터 소유권과 같은 문제를 적극적으로 해결하며 AI 도입을 가속화하는 것이 민간 부문의 특징""이라며 ""공공부문도 이러한 민간의 접근법에서 배울 점이 많다""고 말했다.이어 그는 ""AI 업무 혁신을 성공적으로 이루기 위해서는 조직 전체가 참여해 유즈 케이스를 발굴하고 데이터를 체계적으로 정비하는 것이 중요하다""며 ""공공부문 역시 민간의 성공 경험과 노하우를 접목한다면 행정 혁신의 속도가 더욱 빨라질 것""이라고 강조했다.행사에는 이용석 행정안전부 디지털정부혁신실장도 참석해 AI 행정혁신 노력의 중요성을 강조했다. 그는 ""디지털 기술과 AI는 재정 악화, 저출생, 세대 갈등 등 국가적 난제를 해결할 실마리가 될 수 있다""며 ""행정 효율성을 높이고 국민의 신뢰를 확보하는 데 중요한 역할을 할 것""이라고 전망했다.이어 그는 ""사회적 도전을 해결하며 안정적인 행정 서비스를 유지하는 것은 시대적 사명으로, 이번 토론회가 발전적인 방안을 마련하는 계기가 되기를 기대한다""고 말했다.",0,https://imgnews.pstatic.net/image/277/2024/12/27/0005524098_001_20241227100220702.jpg?type=w860,https://n.news.naver.com/mnews/article/277/0005524098?sid=101
경제,아시아경제,"[특징주]삼성SDS, 실적 부진 전망에 약세…신저가",2024.12.27. 오전 10:01,"삼성에스디에스가 3일 연속 하락세를 지속하며 장중 52주 신저가를 기록했다.27일 오전 9시55분 현재 삼성에스디에스는 전일 대비 2600원(2.01%) 하락한 12만6700원에 거래되고 있다. 장중 12만5400원까지 하락하며 52주 신저가를 갈아치웠다.실적 부진 전망이 주가에 영향을 미친 것으로 풀이된다. 이날 현대차증권은 삼성에스디에스에 대해 올해 4분기 및 내년 실적 전망치를 업황 반영에 따라 하향 조정하면서 목표주가를 18만원으로 기존 대비 10% 낮췄다. 김현용 현대차증권 연구원은 ""삼성에스디에스의 4분기 실적은 매출액 전년 동기 대비 7.3% 증가한 3조6234억원, 영업이익 5% 증가한 2252억원으로 컨센서스(증권사 전망치 평균) 이익을 10% 하회할 것""이라며 ""추세적 반등을 기대하기는 어려운 상황이며 1월쯤 배당과 더불어 추가적인 주주환원책이 나올 가능성이 있는 점은 기대 요소""라고 말했다.",0,https://imgnews.pstatic.net/image/277/2024/12/27/0005524098_001_20241227100220702.jpg?type=w860,https://n.news.naver.com/mnews/article/277/0005524098?sid=101
경제,파이낸셜뉴스,"삼성SDS, 추세적 반등 어려워... 목표가 10%↓-현대차證",2024.12.27. 오전 9:07,"삼성SDS 사옥. 사진=뉴시스[파이낸셜뉴스] 현대차증권은 27일 삼성SDS에 대해 4·4분기 실적 부진이 예상된다며 추세적인 반등을 기대하기 어려운 상황이라고 짚었다. 이에 투자의견은 '매수'로 유지하되 목표주가를 기존 20만원에서 18만원으로 하향 조정했다.현대차증권 김현용 연구원은 ""삼성SDS에 대해 4·4분기 매출액 3조6234억원, 영업이익 2252억원이 예상된다""며 ""시장 전망치(컨센서스)를 약 10% 하회할 전망""이라고 말했다.이어 김 연구원은 ""영업이익을 살펴보면 IT 서비스 부진이 이익 성장률 둔화의 원인으로 예상된다""며 ""IT 서비스 영업이익률은 11.4%로 전년 동기 대비 소폭 감소로 전망하는데, 이는 솔루션 개발비용 증가에 기인한 것으로 보인다""고 설명했다.내년도 사업 목표도 보수적이라는 평가다. 삼성SDS의 내년도 사업 목표로 매출액 14조4000억원, 영업이익 9300원을 제시했다.김 연구원은 ""삼성SDS의 내년도 목표는 올해 전망치 대비 매출 4.3% 증가, 영업이익 0.6% 증가로 보수적인 가이던스에 해당한다""며 ""추세적인 반등을 기대하기 어려운 상황""이라고 짚었다. 다만 그는 ""1월경 배당과 더불어 추가적인 주주환원책이 나올 가능성이 있는 점은 기대요소""라고 덧붙였다.#삼성SDS",0,https://imgnews.pstatic.net/image/277/2024/12/27/0005524098_001_20241227100220702.jpg?type=w860,https://n.news.naver.com/mnews/article/277/0005524098?sid=101
경제,조선비즈,"현대차證 “삼성SDS, 4분기 실적 부진 전망… 목표가 10% 하향”",2024.12.27. 오전 8:59,"현대차증권은 27일 삼성에스디에스의 올해 4분기 영업이익이 시장 전망치를 10% 하회하며 부진할 것으로 전망했다. 이에 투자의견은 ‘매수(BUY)’를 유지했지만, 목표주가는 18만원으로 10% 하향했다. 전 거래일 삼성에스디에스는 12만9300원에 거래를 마쳤다.서울 송파구 삼성SDS 사옥. /뉴스1현대차증권에 따르면 삼성에스디에스의 올 4분기 매출액은 전년 동기 대비 7.3% 증가한 3조6234억원, 영업이익은 5.0% 늘어난 2252억원으로 예상됐다. 이는 시장 전망치를 10% 하회하는 수치다.삼성에스디에스는 내년 사업 목표도 보수적으로 제시했다. 이 회사의 내년 목표 매출액은 14조4000억원, 영업이익은 9300억원 이상이었다. 올해 전망치 대비로는 매출은 4.3%, 영업이익은 0.6% 증가하는 보수적인 가이던스(기업 전망치)에 해당한다는 설명이다.김현용 현대차증권 연구원은 “IT 서비스 부진이 이익 성장률 둔화의 원인으로 예상한다”면서 “IT 서비스 영업이익률은 11.4%로 전년 동기 대비 소폭 감소할 것으로 보고 있는데, 이는 설루션 개발 비용 증가에 기인한다”고 했다.이에 김 연구원은 “삼성에스디에스 목표주가를 18만원으로 기존 대비 10% 하향 조정하는데, 이는 올 4분기와 내년 실적 전망치를 업황 반영에 따라 하향한 탓”이라며 “추세적 반등을 기대하기는 어려운 상황이며, 1월쯤 배당과 더불어 추가적인 주주환원책이 나올 가능성이 있는 점은 기대 요소”라고 했다.",0,https://imgnews.pstatic.net/image/277/2024/12/27/0005524098_001_20241227100220702.jpg?type=w860,https://n.news.naver.com/mnews/article/277/0005524098?sid=101
IT,디지털데일리,한국예탁결제원 700억 원 규모 차세대 시스템 구축 착수…IT서비스 빅3 경쟁에 관심,2024.12.27. 오전 8:21,"[디지털데일리 이상일기자] 한국예탁결제원(이하 예탁원)이 창립 50주년을 맞이해 금융 인프라의 안정성 강화를 위한 디지털 혁신에 본격 나선다.12월 6일 창립 50주년을 맞은 예탁원은 증권 집중예탁과 계좌 대체 및 결제 업무를 통해 자본시장 인프라 역할을 수행해왔다. 또한 시장 수요에 부응하는 신규 서비스를 지속적으로 도입하며 전자투표와 증권 파이낸싱 지원, 글로벌 증권 관리 등 핵심 금융 기능을 제공하고 있다.현재 예탁원은 약 6975조 원 규모의 국민 자산을 안전하게 관리하고 있으며, 해외 40개 시장에서 외화증권 거래와 관리도 지원하고 있다. 특히 미국 증권 결제 기간을 기존 2일에서 1일로 단축하고, 세계국채지수(WGBI) 편입을 위한 ICSD 국채 통합계좌 구축을 통해 글로벌 투자환경 개선에도 기여하고 있다.새로운 50년을 준비하는 예탁원은 디지털 혁신의 일환으로 700억 원 규모의 차세대 시스템 구축을 본격적으로 추진한다. 이번 프로젝트는 기존의 e-SAFE 시스템을 대체할 신기술 기반의 새로운 금융 인프라 시스템을 도입하는 데 중점을 둔다.현행 시스템은 2011년 도입돼 약 13년간 운영되어 왔으나, 하드웨어 및 소프트웨어의 노후화로 안정성 및 확장성에 한계가 지적되어 왔다. 이번 차세대 시스템은 금융시장의 디지털 전환 요구에 부응하고, 신속한 서비스 개선이 가능한 독립 시스템 구조로 설계된다.새로운 시스템 구축은 단계적으로 진행되며, 1단계에서는 글로벌 투자 지원과 증권 대행 업무의 독립 시스템을 마련한다. 이를 통해 외화 증권 거래의 효율성을 높이고, 전자 문서 관리 및 AI 기반 문서 처리 시스템을 도입해 업무 자동화와 안정성을 강화할 예정이다. AI-OCR 도입으로 문서의 판독 및 관리가 자동화되며, 데이터 처리 및 관리 효율성도 크게 향상될 전망이다.업무시스템 및 IT인프라 사업 추진 일정(한국예탁결제원)특히 경영지원 시스템의 디지털 전환도 추진된다. 인사·급여, 예산·회계 등 21개 경영지원 시스템을 재구축해 업무 효율성을 높이고, 협업 솔루션 및 전자 서명 시스템을 도입해 디지털 워크플레이스를 구현한다. 이를 통해 사내 소통과 협업 환경이 개선되고, 문서중앙화 및 AI 기반 회의록 작성 기능도 도입될 계획이다.IT 인프라 측면에서는 최신 표준 아키텍처 기반의 서버 및 네트워크 인프라가 재구축되며, 안정적이고 확장성 있는 클라우드 기반 시스템을 도입한다. 또한 개인정보 보호 강화를 위해 암호화 및 인증 시스템이 업그레이드되고, 보안 체계가 전면 재정비된다. 기존 단일 시스템 구조의 한계를 극복하고, 장애 발생 시에도 독립 운영이 가능한 분산 아키텍처가 적용된다.이번 차세대 시스템 구축 사업은 약 16개월에 걸쳐 진행되며, 단계별 테스트와 안정화 작업을 통해 완성도를 높인다는 계획이다. 예탁원은 이를 통해 금융 인프라의 안전성과 효율성을 강화하고, 글로벌 금융시장과의 연계를 더욱 강화할 방침이다.예탁원은 상법 개정안 통과에 대비해 전자 주주총회 시스템 개발도 추진할 계획이다. 이 시스템은 비대면 환경에서의 주주총회를 효율적으로 운영할 수 있는 기반을 제공해 기업의 경영 투명성을 높일 것으로 기대된다. 또한, ATS(대체거래소) 출범에 따른 청산결제 인프라 개편과 토큰 증권 관리 시스템 도입 등 다양한 신기술 적용 계획도 발표했다.한편 내년도 금융 IT시장이 경색될 가능성도 높아진 가운데 700억원 이상의 예탁결제원 사업에 주요 금융IT 업체들이 달려들 것으로 보인다. 대형 SI사는 물론 중견 SI사들까지 관련 사업 제안을 검토 중인 것으로 알려진다. 앞서 2011년 2월에 가동한 예탁결제원 차세대시스템은 LG CNS가 수주한 바 있다. 당시 LG CNS는 SK C&C와 경쟁 끝에 사업을 수주했다. 삼성SDS는 당시 대외사업에서 철수하면서 사업에 참여하지 않았다.",0,https://imgnews.pstatic.net/image/277/2024/12/27/0005524098_001_20241227100220702.jpg?type=w860,https://n.news.naver.com/mnews/article/277/0005524098?sid=101
오피니언,블로터,[데스크시각] 삼성·SK에 'LG CNS 상장'이 중요한 이유,2024.12.27. 오전 6:00,국내 증시가 기록적인 한파를 이어가는 가운데 기업공개(IPO)를 추진하고 있는 LG그룹의 IT서비스 계열사 LG CNS에 대한 관심이 높아지고 있다.LG CNS는 이달 5일 금융위원회에 증권신고서를 제출하고 공모절차에 착수했다. 내년 2월 유가증권시장(KOSPI)에 상장하는 것이 목표다. LG CNS의 상장 추진에 대해서는 투자자들뿐만 아니라 다른 국내 IT서비스 기업들도 관심을 나타내고 있다. 현재 상장된 주요 IT서비스 대기업은 △삼성SDS △SK㈜(SK㈜ C&C) △현대오토에버 △포스코DX △아시아나IDT △신세계I&C △롯데이노베이트 등이다.그룹에 소속된 IT서비스 대기업들은 그룹 계열사에 대한 매출 의존도가 높다. LG CNS도 매출의 약 60%가 그룹 계열사들로부터 나온다. IT서비스 대기업은 탄탄한 비즈니스 모델을 갖춘 그룹 계열사들을 주요 고객으로 두고 있어 안정적인 매출을 낸다. 하지만 그룹 밖으로 눈을 돌리면 상황이 달라진다. 공공 시장은 대기업참여제한 규제로 인해 진입하기가 어렵다. 공공 프로젝트는 공공기관의 제한적인 예산으로 인해 시스템통합(SI) 기업의 이익률이 낮다. 이 때문에 대기업의 관심도가 낮다. 그나마 인공지능(AI)과 클라우드 등 신기술이 적용된 사업이라면 대기업이 도전할 수 있다. IT서비스 기업의 고객 중 큰손들이 몰려 있는 금융시장도 주요 타깃이다. 금융기관은 수년에 한 번씩 기존 시스템을 최신 기술이 적용된 시스템으로 갈아 엎는 '차세대 시스템 구축 프로젝트'를 발주한다. 사업 규모가 수천억원이다보니 IT서비스 기업의 관심도가 높다. 그만큼 경쟁도 치열하다.IT서비스 대기업은 소속 그룹의 오너와도 연관이 깊다. IT서비스 대기업의 최대주주는 그룹의 지주사인 경우가 대부분이다. 지주사의 최대주주는 그룹의 오너다. 이 때문에 IT서비스 대기업의 주가는 직·간접적으로 오너의 이익과 연결된다. 오너가 각종 소송 등 개인적인 일로 자금이 필요한 경우에도 제기되는 추측이 IT서비스 기업의 지분 매각이다. 이는 기업의 본질적인 사업 경쟁력과 관계없이 주가에 영향을 미친다.이처럼 국내 시장에서 한정적인 비즈니스 모델을 갖춘 가운데 오너의 영향을 받고 있다보니 그룹 소속 IT서비스 상장사의 주가는 좀처럼 힘을 내지 못하고 있다. IT서비스 기업 중 가장 규모가 큰 삼성SDS도 주가가 지난 수년간 10만원 초중반대에 갇혀있다.이런 가운데 LG CNS의 이번 상장 추진이 주목받는 이유 중 하나가 글로벌 진출에 대한 계획이다. 회사는 증권신고서를 통해 이번 상장을 통해 유치할 것으로 예상되는 자금 5150억원 중 3300억원을 해외 IT전문기업을 인수하는데 쓰겠다는 뜻을 나타냈다. 회사는 현재 인수 대상 후보 기업을 찾고 있다. 또 상장 추진시 기재해야 하는 비교기업에 삼성SDS·현대오토에버 외에 일본 IT 기업 NTT DATA Group(NTT데이터)도 포함시켰다. 글로벌 시장 진출을 염두에 둔 행보다.다른 IT서비스 대기업도 LG CNS의 행보에 관심을 기울이고 있다. IT서비스 기업이 국내 기업의 해외 사업을 지원하는 것을 제외하고 현지에서 고객사를 발굴해 사업을 펼치는 경우는 적다. LG CNS가 성공적으로 상장한 이후 글로벌 시장에서도 의미있는 결과를 낸다면 이는 그룹 계열사 의존도가 높은 국내 다른 IT서비스 대기업에게도 좋은 사례가 될 수 있다.우려 섞인 시선도 있다. 글로벌 AI·클라우드 시장에는 국내보다 더 쟁쟁한 경쟁자가 포진하고 있다. 글로벌 시장에 대규모 투자를 했지만 성과를 내지 못한다면 이는 곧 회사의 주가에 악영향으로 작용할 수 있다. 이는 추후 글로벌 시장 진출을 노리고 있는 다른 국내 IT서비스 기업에게도 악재다. 해외 고객사가 한국 IT 서비스의 품질을 평가할 때 LG CNS를 표준으로 삼을 수 있기 때문이다.LG그룹에게도 LG CNS의 성공적인 상장과 글로벌 진출은 중요하다. 구광모 LG 회장은 올해 3분기말 기준 LG CNS의 지분 1.12%를 보유했다. LG CNS가 상장으로 대규모 자금을 유치하고 이를 기반으로 글로벌 시장에서 성공적인 사례를 남긴다면 이는 주가 상승의 원동력이 된다. 구 회장의 지분가치 상승으로도 연결된다.AI 시대를 맞아 소프트웨어 역량이 무엇보다 중요해진 가운데 LG그룹의 유일한 IT서비스 기업 LG CNS의 가치를 시장에서 인정받는다면 이는 그룹의 브랜드 가치 상승으로도 이어질 수 있다. LG그룹은 △㈜LG △LG전자 △LG화학 △LG생활건강 △LG디스플레이 △LG유플러스 △LG이노텍 △에이치에스애드 △로보스타 △LG헬로비전 △LG에너지솔루션 등의 상장사를 보유하고 있다.,1,https://imgnews.pstatic.net/image/138/2024/12/27/0002188584_001_20241227113209927.jpeg?type=w860,https://n.news.naver.com/mnews/article/138/0002188584?sid=105
사회,조선일보,“AI 능력이 미래 임금 좌우… 공교육이 나서야 격차 줄 것”,2024.12.27. 오전 12:51,"본사 주최 미래사회 교육 컨퍼런스“지금 학생들이 사회에 진출할 때면 인공지능(AI) 활용 능력이 임금 수준을 결정할 겁니다. ‘AI 교육 격차’가 ‘임금 격차’가 되지 않도록 공교육이 책임져야 합니다.”26일 조선일보가 서울 중구 웨스틴조선호텔에서 주최한 ‘2025 미래사회 교육 컨퍼런스’에서 이경전 경희대 경영학·빅데이터응용학과 교수가 ‘AI 시대의 교육 혁신과 인재 육성’을 주제로 기조 강연을 하며 이같이 말했다. 이 교수는 “맥킨지 연구소에 따르면 2030년까지 근로자 총임금의 약 13%가 높은 수준의 디지털 기술이 필요한 작업으로 전환되고 디지털 기술이 낮은 근로자 임금은 정체 또는 감소할 것”이라며 “학생들이 AI 기술을 활용하는 ‘생산자’가 될 수 있도록 하는 국가 차원의 교육 개발과 적용이 시급하다”고 했다.근거로 최근 발표된 마이크로소프트 연구소의 ‘미국에서 떠오르는 AI 격차’ 보고서 내용을 들었다. 미 캘리포니아주 등 교육 수준과 소득이 높은 미국 서부 지역의 ‘챗GPT’(생성형 AI) 사용 비율이 루이지애나 등 미국 남부 지역에 비해 높다는 내용이다. 이 교수는 “‘AI 불균형’은 갈수록 심화할 것”이라며 “한국은 사교육 의존도가 높아 공교육이 AI 교육을 주도하지 않으면 더 격차가 심해질 것”이라고 했다. 특히 그는 “‘AI 디지털 교과서’가 학생들의 AI 활용 능력을 기르는 데 결정적인 역할을 할 것”이라고 했다.이날 기조 강연을 한 이주호 사회부총리 겸 교육부 장관은 “AI 시대가 오며 개념을 단순히 암기하는 방식의 교육은 이제 끝났다”며 “개념적 지식 위에 창의성, 인성, 융합 역량, 비판적 사고, 컴퓨팅 사고 등을 엮는 개념 활용 능력을 중심으로 교육해야 한다”고 했다. 이 부총리는 이처럼 AI 시대를 대비한 ‘교육 혁명’이 가능하기 위해서는 AI 교과서처럼 교육 현장의 도구로 AI를 쓰는 것이 필수라고 본다. 이 부총리는 “AI가 교실에서 수업 자료를 만들고 학생이 필요로 하는 지식 전달의 보조자가 되고, 교사는 이 전반을 지휘·관리하는 ‘학습 디자이너’가 돼야 한다”고 했다.26일 서울 중구 웨스틴조선호텔에서 조선일보 주최로 열린 '2025 미래사회 교육 컨퍼런스'에서 이주호 사회부총리 겸 교육부 장관이 'AI(인공지능) 시대의 교육 혁신과 인재 육성'을 주제로 기조 강연을 하고 있다. /장련성 기자이 부총리는 AI 시대 인재를 교육하는 또 다른 핵심은 ‘인성 교육’이라고 강조했다. 최근 학교 현장에서는 딥페이크와 같이 생성형 AI 기술을 이용해 친구의 얼굴을 음란물에 합성하는 등 사건이 연이어 드러나며 큰 논란이 됐다. 이 부총리는 “아이들이 AI를 비윤리적인 용도로 쓰거나, AI로 인해 디지털에 과몰입하는 것을 방지하기 위한 ‘디지털 시민 교육’을 철저히 시행하겠다”고 했다. 이날 강은희 전국시도교육감협의회 회장도 “AI가 교육 패러다임을 근본적으로 변화시키는 가운데 학교는 인간만이 소유한 창의적 사고와 공동체 가치를 이해하고 서로 협력하는 인재가 되도록 지도해야 한다”고 했다.국내 주요 기업 AI 관련 부서 임원들은 AI 시대가 오며 인재상도 급변해 혼란하다며 대학이 중심을 잡아줘야 한다고 입을 모았다. 이태희 삼성SDS AI연구팀 상무는 “AI의 기술·학문적 가치가 무엇인지 대학이 토대를 세워줘야 한다”고 했다. 김영옥 HD현대 AI센터 상무는 “알고리즘 구조를 파악해 AI를 논리 정연하게 활용하고 커뮤니케이션하는 ‘기초 능력’을 대학이 탄탄히 교육해야 한다”고 했다.이날 컨퍼런스에 참석한 김동원 고려대 총장은 “앞으로 대학은 AI와 함께 일하며 상호 보완적인 협업을 통해 문제를 해결해 나가는 인재를 양성해야 한다”고 했다. 김은미 이화여대 총장은 “사회적 규범, 문제, 책무성을 고민하는 ‘성숙한 AI’를 구현하기 위한 인재를 양성하는 것이 대학의 역할”이라고 했다. 유홍림 서울대 총장은 “입법 과정에도 AI가 적용될 필요가 있다”며 “AI가 정책별 데이터를 분석하고 입법 수요를 파악하면 더욱 국민 입장에 가까운 입법이 이뤄질 것”이라고 했다.",1,https://imgnews.pstatic.net/image/138/2024/12/27/0002188584_001_20241227113209927.jpeg?type=w860,https://n.news.naver.com/mnews/article/138/0002188584?sid=105
